No.     Time           Source                Destination           Protocol Length Info
      4 0.757544010    10.3.141.125          192.168.8.120         HTTP     242    GET /?custom=1&cmd=3012 HTTP/1.1 

Frame 4: 242 bytes on wire (1936 bits), 242 bytes captured (1936 bits) on interface wlan0, id 0
Ethernet II, Src: Apple_a6:df:21 (68:83:cb:a6:df:21), Dst: RaspberryPiF_89:0f:fc (b8:27:eb:89:0f:fc)
Internet Protocol Version 4, Src: 10.3.141.125 (10.3.141.125), Dst: 192.168.8.120 (192.168.8.120)
    0100 .... = Version: 4
    .... 0101 = Header Length: 20 bytes (5)
    Differentiated Services Field: 0x02 (DSCP: CS0, ECN: ECT(0))
        0000 00.. = Differentiated Services Codepoint: Default (0)
        .... ..10 = Explicit Congestion Notification: ECN-Capable Transport codepoint '10' (2)
    Total Length: 228
    Identification: 0x0000 (0)
    010. .... = Flags: 0x2, Don't fragment
    ...0 0000 0000 0000 = Fragment Offset: 0
    Time to Live: 64
    Protocol: TCP (6)
    Header Checksum: 0xd971 [validation disabled]
    [Header checksum status: Unverified]
    Source Address: 10.3.141.125 (10.3.141.125)
    Destination Address: 192.168.8.120 (192.168.8.120)
    [Stream index: 0]
Transmission Control Protocol, Src Port: 53214 (53214), Dst Port: http (80), Seq: 1, Ack: 1, Len: 176
    Source Port: 53214 (53214)
    Destination Port: http (80)
    [Stream index: 0]
    [Conversation completeness: Complete, WITH_DATA (63)]
    [TCP Segment Len: 176]
    Sequence Number: 1    (relative sequence number)
    Sequence Number (raw): 1870207887
    [Next Sequence Number: 177    (relative sequence number)]
    Acknowledgment Number: 1    (relative ack number)
    Acknowledgment number (raw): 1133038735
    1000 .... = Header Length: 32 bytes (8)
    Flags: 0x018 (PSH, ACK)
    Window: 2058
    [Calculated window size: 131712]
    [Window size scaling factor: 64]
    Checksum: 0x2011 [unverified]
    [Checksum Status: Unverified]
    Urgent Pointer: 0
    Options: (12 bytes), No-Operation (NOP), No-Operation (NOP), Timestamps
    [Timestamps]
    [SEQ/ACK analysis]
    TCP payload (176 bytes)
Hypertext Transfer Protocol
    GET /?custom=1&cmd=3012 HTTP/1.1\r\n
    Host: 192.168.8.120\r\n
    User-Agent: WILDLIFE CAM 1.0.8 rv:25010602 (iPhone; iOS 18.3.1; en_US)\r\n
    Connection: keep-alive\r\n
    Accept-Encoding: gzip\r\n
    \r\n
    [Response in frame: 8]
    [Full request URI: http://192.168.8.120/?custom=1&cmd=3012]

No.     Time           Source                Destination           Protocol Length Info
      8 4.213982915    192.168.8.120         10.3.141.125          HTTP     398    HTTP/1.1 200 OK  (text/xml)

Frame 8: 398 bytes on wire (3184 bits), 398 bytes captured (3184 bits) on interface wlan0, id 0
Ethernet II, Src: RaspberryPiF_89:0f:fc (b8:27:eb:89:0f:fc), Dst: Apple_a6:df:21 (68:83:cb:a6:df:21)
Internet Protocol Version 4, Src: 192.168.8.120 (192.168.8.120), Dst: 10.3.141.125 (10.3.141.125)
    0100 .... = Version: 4
    .... 0101 = Header Length: 20 bytes (5)
    Differentiated Services Field: 0x02 (DSCP: CS0, ECN: ECT(0))
        0000 00.. = Differentiated Services Codepoint: Default (0)
        .... ..10 = Explicit Congestion Notification: ECN-Capable Transport codepoint '10' (2)
    Total Length: 384
    Identification: 0x89ea (35306)
    010. .... = Flags: 0x2, Don't fragment
    ...0 0000 0000 0000 = Fragment Offset: 0
    Time to Live: 63
    Protocol: TCP (6)
    Header Checksum: 0x4feb [validation disabled]
    [Header checksum status: Unverified]
    Source Address: 192.168.8.120 (192.168.8.120)
    Destination Address: 10.3.141.125 (10.3.141.125)
    [Stream index: 0]
Transmission Control Protocol, Src Port: http (80), Dst Port: 53214 (53214), Seq: 198, Ack: 177, Len: 332
    Source Port: http (80)
    Destination Port: 53214 (53214)
    [Stream index: 0]
    [Conversation completeness: Complete, WITH_DATA (63)]
    [TCP Segment Len: 332]
    Sequence Number: 198    (relative sequence number)
    Sequence Number (raw): 1133038932
    [Next Sequence Number: 531    (relative sequence number)]
    Acknowledgment Number: 177    (relative ack number)
    Acknowledgment number (raw): 1870208063
    1000 .... = Header Length: 32 bytes (8)
    Flags: 0x019 (FIN, PSH, ACK)
    Window: 50504
    [Calculated window size: 50504]
    [Window size scaling factor: 1]
    Checksum: 0xb8f6 [unverified]
    [Checksum Status: Unverified]
    Urgent Pointer: 0
    Options: (12 bytes), No-Operation (NOP), No-Operation (NOP), Timestamps
    [Timestamps]
    [SEQ/ACK analysis]
    TCP payload (332 bytes)
    TCP segment data (332 bytes)
[3 Reassembled TCP Segments (529 bytes): #6(197), #8(332), #12(332)]
Hypertext Transfer Protocol
Media Type

No.     Time           Source                Destination           Protocol Length Info
     17 4.806812081    10.3.141.125          192.168.8.120         HTTP     257    GET /?custom=1&cmd=3005&str=2025-02-17 HTTP/1.1 

Frame 17: 257 bytes on wire (2056 bits), 257 bytes captured (2056 bits) on interface wlan0, id 0
Ethernet II, Src: Apple_a6:df:21 (68:83:cb:a6:df:21), Dst: RaspberryPiF_89:0f:fc (b8:27:eb:89:0f:fc)
Internet Protocol Version 4, Src: 10.3.141.125 (10.3.141.125), Dst: 192.168.8.120 (192.168.8.120)
    0100 .... = Version: 4
    .... 0101 = Header Length: 20 bytes (5)
    Differentiated Services Field: 0x02 (DSCP: CS0, ECN: ECT(0))
        0000 00.. = Differentiated Services Codepoint: Default (0)
        .... ..10 = Explicit Congestion Notification: ECN-Capable Transport codepoint '10' (2)
    Total Length: 243
    Identification: 0x0000 (0)
    010. .... = Flags: 0x2, Don't fragment
    ...0 0000 0000 0000 = Fragment Offset: 0
    Time to Live: 64
    Protocol: TCP (6)
    Header Checksum: 0xd962 [validation disabled]
    [Header checksum status: Unverified]
    Source Address: 10.3.141.125 (10.3.141.125)
    Destination Address: 192.168.8.120 (192.168.8.120)
    [Stream index: 0]
Transmission Control Protocol, Src Port: 53215 (53215), Dst Port: http (80), Seq: 1, Ack: 1, Len: 191
    Source Port: 53215 (53215)
    Destination Port: http (80)
    [Stream index: 1]
    [Conversation completeness: Complete, WITH_DATA (31)]
    [TCP Segment Len: 191]
    Sequence Number: 1    (relative sequence number)
    Sequence Number (raw): 3778953790
    [Next Sequence Number: 192    (relative sequence number)]
    Acknowledgment Number: 1    (relative ack number)
    Acknowledgment number (raw): 3157057415
    1000 .... = Header Length: 32 bytes (8)
    Flags: 0x018 (PSH, ACK)
    Window: 2058
    [Calculated window size: 131712]
    [Window size scaling factor: 64]
    Checksum: 0xedf7 [unverified]
    [Checksum Status: Unverified]
    Urgent Pointer: 0
    Options: (12 bytes), No-Operation (NOP), No-Operation (NOP), Timestamps
    [Timestamps]
    [SEQ/ACK analysis]
    TCP payload (191 bytes)
Hypertext Transfer Protocol
    GET /?custom=1&cmd=3005&str=2025-02-17 HTTP/1.1\r\n
    Host: 192.168.8.120\r\n
    User-Agent: WILDLIFE CAM 1.0.8 rv:25010602 (iPhone; iOS 18.3.1; en_US)\r\n
    Connection: keep-alive\r\n
    Accept-Encoding: gzip\r\n
    \r\n
    [Response in frame: 23]
    [Full request URI: http://192.168.8.120/?custom=1&cmd=3005&str=2025-02-17]

No.     Time           Source                Destination           Protocol Length Info
     23 4.914593175    192.168.8.120         10.3.141.125          HTTP     163    HTTP/1.1 200 OK  (text/xml)

Frame 23: 163 bytes on wire (1304 bits), 163 bytes captured (1304 bits) on interface wlan0, id 0
Ethernet II, Src: RaspberryPiF_89:0f:fc (b8:27:eb:89:0f:fc), Dst: Apple_a6:df:21 (68:83:cb:a6:df:21)
Internet Protocol Version 4, Src: 192.168.8.120 (192.168.8.120), Dst: 10.3.141.125 (10.3.141.125)
    0100 .... = Version: 4
    .... 0101 = Header Length: 20 bytes (5)
    Differentiated Services Field: 0x02 (DSCP: CS0, ECN: ECT(0))
        0000 00.. = Differentiated Services Codepoint: Default (0)
        .... ..10 = Explicit Congestion Notification: ECN-Capable Transport codepoint '10' (2)
    Total Length: 149
    Identification: 0x7cce (31950)
    010. .... = Flags: 0x2, Don't fragment
    ...0 0000 0000 0000 = Fragment Offset: 0
    Time to Live: 63
    Protocol: TCP (6)
    Header Checksum: 0x5df2 [validation disabled]
    [Header checksum status: Unverified]
    Source Address: 192.168.8.120 (192.168.8.120)
    Destination Address: 10.3.141.125 (10.3.141.125)
    [Stream index: 0]
Transmission Control Protocol, Src Port: http (80), Dst Port: 53215 (53215), Seq: 197, Ack: 192, Len: 97
    Source Port: http (80)
    Destination Port: 53215 (53215)
    [Stream index: 1]
    [Conversation completeness: Complete, WITH_DATA (31)]
    [TCP Segment Len: 97]
    Sequence Number: 197    (relative sequence number)
    Sequence Number (raw): 3157057611
    [Next Sequence Number: 295    (relative sequence number)]
    Acknowledgment Number: 192    (relative ack number)
    Acknowledgment number (raw): 3778953981
    1000 .... = Header Length: 32 bytes (8)
    Flags: 0x019 (FIN, PSH, ACK)
    Window: 50489
    [Calculated window size: 50489]
    [Window size scaling factor: 1]
    Checksum: 0x6b0b [unverified]
    [Checksum Status: Unverified]
    Urgent Pointer: 0
    Options: (12 bytes), No-Operation (NOP), No-Operation (NOP), Timestamps
    [Timestamps]
    [SEQ/ACK analysis]
    TCP payload (97 bytes)
    TCP segment data (97 bytes)
[2 Reassembled TCP Segments (293 bytes): #21(196), #23(97)]
Hypertext Transfer Protocol
Media Type

No.     Time           Source                Destination           Protocol Length Info
     30 5.037368019    10.3.141.125          192.168.8.120         HTTP     255    GET /?custom=1&cmd=3006&str=12:01:25 HTTP/1.1 

Frame 30: 255 bytes on wire (2040 bits), 255 bytes captured (2040 bits) on interface wlan0, id 0
Ethernet II, Src: Apple_a6:df:21 (68:83:cb:a6:df:21), Dst: RaspberryPiF_89:0f:fc (b8:27:eb:89:0f:fc)
Internet Protocol Version 4, Src: 10.3.141.125 (10.3.141.125), Dst: 192.168.8.120 (192.168.8.120)
    0100 .... = Version: 4
    .... 0101 = Header Length: 20 bytes (5)
    Differentiated Services Field: 0x02 (DSCP: CS0, ECN: ECT(0))
        0000 00.. = Differentiated Services Codepoint: Default (0)
        .... ..10 = Explicit Congestion Notification: ECN-Capable Transport codepoint '10' (2)
    Total Length: 241
    Identification: 0x0000 (0)
    010. .... = Flags: 0x2, Don't fragment
    ...0 0000 0000 0000 = Fragment Offset: 0
    Time to Live: 64
    Protocol: TCP (6)
    Header Checksum: 0xd964 [validation disabled]
    [Header checksum status: Unverified]
    Source Address: 10.3.141.125 (10.3.141.125)
    Destination Address: 192.168.8.120 (192.168.8.120)
    [Stream index: 0]
Transmission Control Protocol, Src Port: 53216 (53216), Dst Port: http (80), Seq: 1, Ack: 1, Len: 189
    Source Port: 53216 (53216)
    Destination Port: http (80)
    [Stream index: 2]
    [Conversation completeness: Complete, WITH_DATA (31)]
    [TCP Segment Len: 189]
    Sequence Number: 1    (relative sequence number)
    Sequence Number (raw): 4222311049
    [Next Sequence Number: 190    (relative sequence number)]
    Acknowledgment Number: 1    (relative ack number)
    Acknowledgment number (raw): 3738141908
    1000 .... = Header Length: 32 bytes (8)
    Flags: 0x018 (PSH, ACK)
    Window: 2058
    [Calculated window size: 131712]
    [Window size scaling factor: 64]
    Checksum: 0xdf09 [unverified]
    [Checksum Status: Unverified]
    Urgent Pointer: 0
    Options: (12 bytes), No-Operation (NOP), No-Operation (NOP), Timestamps
    [Timestamps]
    [SEQ/ACK analysis]
    TCP payload (189 bytes)
Hypertext Transfer Protocol
    GET /?custom=1&cmd=3006&str=12:01:25 HTTP/1.1\r\n
    Host: 192.168.8.120\r\n
    User-Agent: WILDLIFE CAM 1.0.8 rv:25010602 (iPhone; iOS 18.3.1; en_US)\r\n
    Connection: keep-alive\r\n
    Accept-Encoding: gzip\r\n
    \r\n
    [Response in frame: 33]
    [Full request URI: http://192.168.8.120/?custom=1&cmd=3006&str=12:01:25]

No.     Time           Source                Destination           Protocol Length Info
     33 5.114565414    192.168.8.120         10.3.141.125          HTTP     163    HTTP/1.1 200 OK  (text/xml)

Frame 33: 163 bytes on wire (1304 bits), 163 bytes captured (1304 bits) on interface wlan0, id 0
Ethernet II, Src: RaspberryPiF_89:0f:fc (b8:27:eb:89:0f:fc), Dst: Apple_a6:df:21 (68:83:cb:a6:df:21)
Internet Protocol Version 4, Src: 192.168.8.120 (192.168.8.120), Dst: 10.3.141.125 (10.3.141.125)
    0100 .... = Version: 4
    .... 0101 = Header Length: 20 bytes (5)
    Differentiated Services Field: 0x02 (DSCP: CS0, ECN: ECT(0))
        0000 00.. = Differentiated Services Codepoint: Default (0)
        .... ..10 = Explicit Congestion Notification: ECN-Capable Transport codepoint '10' (2)
    Total Length: 149
    Identification: 0xd514 (54548)
    010. .... = Flags: 0x2, Don't fragment
    ...0 0000 0000 0000 = Fragment Offset: 0
    Time to Live: 63
    Protocol: TCP (6)
    Header Checksum: 0x05ac [validation disabled]
    [Header checksum status: Unverified]
    Source Address: 192.168.8.120 (192.168.8.120)
    Destination Address: 10.3.141.125 (10.3.141.125)
    [Stream index: 0]
Transmission Control Protocol, Src Port: http (80), Dst Port: 53216 (53216), Seq: 197, Ack: 190, Len: 97
    Source Port: http (80)
    Destination Port: 53216 (53216)
    [Stream index: 2]
    [Conversation completeness: Complete, WITH_DATA (31)]
    [TCP Segment Len: 97]
    Sequence Number: 197    (relative sequence number)
    Sequence Number (raw): 3738142104
    [Next Sequence Number: 295    (relative sequence number)]
    Acknowledgment Number: 190    (relative ack number)
    Acknowledgment number (raw): 4222311238
    1000 .... = Header Length: 32 bytes (8)
    Flags: 0x019 (FIN, PSH, ACK)
    Window: 50491
    [Calculated window size: 50491]
    [Window size scaling factor: 1]
    Checksum: 0x388d [unverified]
    [Checksum Status: Unverified]
    Urgent Pointer: 0
    Options: (12 bytes), No-Operation (NOP), No-Operation (NOP), Timestamps
    [Timestamps]
    [SEQ/ACK analysis]
    TCP payload (97 bytes)
    TCP segment data (97 bytes)
[2 Reassembled TCP Segments (293 bytes): #32(196), #33(97)]
Hypertext Transfer Protocol
Media Type

No.     Time           Source                Destination           Protocol Length Info
     41 5.202283591    10.3.141.125          192.168.8.120         HTTP     242    GET /?custom=1&cmd=3016 HTTP/1.1 

Frame 41: 242 bytes on wire (1936 bits), 242 bytes captured (1936 bits) on interface wlan0, id 0
Ethernet II, Src: Apple_a6:df:21 (68:83:cb:a6:df:21), Dst: RaspberryPiF_89:0f:fc (b8:27:eb:89:0f:fc)
Internet Protocol Version 4, Src: 10.3.141.125 (10.3.141.125), Dst: 192.168.8.120 (192.168.8.120)
    0100 .... = Version: 4
    .... 0101 = Header Length: 20 bytes (5)
    Differentiated Services Field: 0x02 (DSCP: CS0, ECN: ECT(0))
        0000 00.. = Differentiated Services Codepoint: Default (0)
        .... ..10 = Explicit Congestion Notification: ECN-Capable Transport codepoint '10' (2)
    Total Length: 228
    Identification: 0x0000 (0)
    010. .... = Flags: 0x2, Don't fragment
    ...0 0000 0000 0000 = Fragment Offset: 0
    Time to Live: 64
    Protocol: TCP (6)
    Header Checksum: 0xd971 [validation disabled]
    [Header checksum status: Unverified]
    Source Address: 10.3.141.125 (10.3.141.125)
    Destination Address: 192.168.8.120 (192.168.8.120)
    [Stream index: 0]
Transmission Control Protocol, Src Port: 53217 (53217), Dst Port: http (80), Seq: 1, Ack: 1, Len: 176
    Source Port: 53217 (53217)
    Destination Port: http (80)
    [Stream index: 3]
    [Conversation completeness: Complete, WITH_DATA (31)]
    [TCP Segment Len: 176]
    Sequence Number: 1    (relative sequence number)
    Sequence Number (raw): 1877948992
    [Next Sequence Number: 177    (relative sequence number)]
    Acknowledgment Number: 1    (relative ack number)
    Acknowledgment number (raw): 210380749
    1000 .... = Header Length: 32 bytes (8)
    Flags: 0x018 (PSH, ACK)
    Window: 2058
    [Calculated window size: 131712]
    [Window size scaling factor: 64]
    Checksum: 0x39d9 [unverified]
    [Checksum Status: Unverified]
    Urgent Pointer: 0
    Options: (12 bytes), No-Operation (NOP), No-Operation (NOP), Timestamps
    [Timestamps]
    [SEQ/ACK analysis]
    TCP payload (176 bytes)
Hypertext Transfer Protocol
    GET /?custom=1&cmd=3016 HTTP/1.1\r\n
    Host: 192.168.8.120\r\n
    User-Agent: WILDLIFE CAM 1.0.8 rv:25010602 (iPhone; iOS 18.3.1; en_US)\r\n
    Connection: keep-alive\r\n
    Accept-Encoding: gzip\r\n
    \r\n
    [Response in frame: 44]
    [Full request URI: http://192.168.8.120/?custom=1&cmd=3016]

No.     Time           Source                Destination           Protocol Length Info
     44 5.208108279    192.168.8.120         10.3.141.125          HTTP     163    HTTP/1.1 200 OK  (text/xml)

Frame 44: 163 bytes on wire (1304 bits), 163 bytes captured (1304 bits) on interface wlan0, id 0
Ethernet II, Src: RaspberryPiF_89:0f:fc (b8:27:eb:89:0f:fc), Dst: Apple_a6:df:21 (68:83:cb:a6:df:21)
Internet Protocol Version 4, Src: 192.168.8.120 (192.168.8.120), Dst: 10.3.141.125 (10.3.141.125)
    0100 .... = Version: 4
    .... 0101 = Header Length: 20 bytes (5)
    Differentiated Services Field: 0x02 (DSCP: CS0, ECN: ECT(0))
        0000 00.. = Differentiated Services Codepoint: Default (0)
        .... ..10 = Explicit Congestion Notification: ECN-Capable Transport codepoint '10' (2)
    Total Length: 149
    Identification: 0x47d3 (18387)
    010. .... = Flags: 0x2, Don't fragment
    ...0 0000 0000 0000 = Fragment Offset: 0
    Time to Live: 63
    Protocol: TCP (6)
    Header Checksum: 0x92ed [validation disabled]
    [Header checksum status: Unverified]
    Source Address: 192.168.8.120 (192.168.8.120)
    Destination Address: 10.3.141.125 (10.3.141.125)
    [Stream index: 0]
Transmission Control Protocol, Src Port: http (80), Dst Port: 53217 (53217), Seq: 197, Ack: 177, Len: 97
    Source Port: http (80)
    Destination Port: 53217 (53217)
    [Stream index: 3]
    [Conversation completeness: Complete, WITH_DATA (31)]
    [TCP Segment Len: 97]
    Sequence Number: 197    (relative sequence number)
    Sequence Number (raw): 210380945
    [Next Sequence Number: 295    (relative sequence number)]
    Acknowledgment Number: 177    (relative ack number)
    Acknowledgment number (raw): 1877949168
    1000 .... = Header Length: 32 bytes (8)
    Flags: 0x019 (FIN, PSH, ACK)
    Window: 50504
    [Calculated window size: 50504]
    [Window size scaling factor: 1]
    Checksum: 0x9915 [unverified]
    [Checksum Status: Unverified]
    Urgent Pointer: 0
    Options: (12 bytes), No-Operation (NOP), No-Operation (NOP), Timestamps
    [Timestamps]
    [SEQ/ACK analysis]
    TCP payload (97 bytes)
    TCP segment data (97 bytes)
[2 Reassembled TCP Segments (293 bytes): #43(196), #44(97)]
Hypertext Transfer Protocol
Media Type

No.     Time           Source                Destination           Protocol Length Info
     52 5.246064841    10.3.141.125          192.168.8.120         HTTP     247    GET /?custom=1&cmd=3031&str= HTTP/1.1 

Frame 52: 247 bytes on wire (1976 bits), 247 bytes captured (1976 bits) on interface wlan0, id 0
Ethernet II, Src: Apple_a6:df:21 (68:83:cb:a6:df:21), Dst: RaspberryPiF_89:0f:fc (b8:27:eb:89:0f:fc)
Internet Protocol Version 4, Src: 10.3.141.125 (10.3.141.125), Dst: 192.168.8.120 (192.168.8.120)
    0100 .... = Version: 4
    .... 0101 = Header Length: 20 bytes (5)
    Differentiated Services Field: 0x02 (DSCP: CS0, ECN: ECT(0))
        0000 00.. = Differentiated Services Codepoint: Default (0)
        .... ..10 = Explicit Congestion Notification: ECN-Capable Transport codepoint '10' (2)
    Total Length: 233
    Identification: 0x0000 (0)
    010. .... = Flags: 0x2, Don't fragment
    ...0 0000 0000 0000 = Fragment Offset: 0
    Time to Live: 64
    Protocol: TCP (6)
    Header Checksum: 0xd96c [validation disabled]
    [Header checksum status: Unverified]
    Source Address: 10.3.141.125 (10.3.141.125)
    Destination Address: 192.168.8.120 (192.168.8.120)
    [Stream index: 0]
Transmission Control Protocol, Src Port: 53218 (53218), Dst Port: http (80), Seq: 1, Ack: 1, Len: 181
    Source Port: 53218 (53218)
    Destination Port: http (80)
    [Stream index: 4]
    [Conversation completeness: Complete, WITH_DATA (31)]
    [TCP Segment Len: 181]
    Sequence Number: 1    (relative sequence number)
    Sequence Number (raw): 276393404
    [Next Sequence Number: 182    (relative sequence number)]
    Acknowledgment Number: 1    (relative ack number)
    Acknowledgment number (raw): 1710345716
    1000 .... = Header Length: 32 bytes (8)
    Flags: 0x018 (PSH, ACK)
    Window: 2058
    [Calculated window size: 131712]
    [Window size scaling factor: 64]
    Checksum: 0xb1c7 [unverified]
    [Checksum Status: Unverified]
    Urgent Pointer: 0
    Options: (12 bytes), No-Operation (NOP), No-Operation (NOP), Timestamps
    [Timestamps]
    [SEQ/ACK analysis]
    TCP payload (181 bytes)
Hypertext Transfer Protocol
    GET /?custom=1&cmd=3031&str= HTTP/1.1\r\n
    Host: 192.168.8.120\r\n
    User-Agent: WILDLIFE CAM 1.0.8 rv:25010602 (iPhone; iOS 18.3.1; en_US)\r\n
    Connection: keep-alive\r\n
    Accept-Encoding: gzip\r\n
    \r\n
    [Response in frame: 55]
    [Full request URI: http://192.168.8.120/?custom=1&cmd=3031&str=]

No.     Time           Source                Destination           Protocol Length Info
     55 5.293604633    192.168.8.120         10.3.141.125          HTTP     1386   HTTP/1.1 200 OK  (text/xml)

Frame 55: 1386 bytes on wire (11088 bits), 1386 bytes captured (11088 bits) on interface wlan0, id 0
Ethernet II, Src: RaspberryPiF_89:0f:fc (b8:27:eb:89:0f:fc), Dst: Apple_a6:df:21 (68:83:cb:a6:df:21)
Internet Protocol Version 4, Src: 192.168.8.120 (192.168.8.120), Dst: 10.3.141.125 (10.3.141.125)
    0100 .... = Version: 4
    .... 0101 = Header Length: 20 bytes (5)
    Differentiated Services Field: 0x02 (DSCP: CS0, ECN: ECT(0))
        0000 00.. = Differentiated Services Codepoint: Default (0)
        .... ..10 = Explicit Congestion Notification: ECN-Capable Transport codepoint '10' (2)
    Total Length: 1372
    Identification: 0x1a14 (6676)
    010. .... = Flags: 0x2, Don't fragment
    ...0 0000 0000 0000 = Fragment Offset: 0
    Time to Live: 63
    Protocol: TCP (6)
    Header Checksum: 0xbbe5 [validation disabled]
    [Header checksum status: Unverified]
    Source Address: 192.168.8.120 (192.168.8.120)
    Destination Address: 10.3.141.125 (10.3.141.125)
    [Stream index: 0]
Transmission Control Protocol, Src Port: http (80), Dst Port: 53218 (53218), Seq: 199, Ack: 182, Len: 1320
    Source Port: http (80)
    Destination Port: 53218 (53218)
    [Stream index: 4]
    [Conversation completeness: Complete, WITH_DATA (31)]
    [TCP Segment Len: 1320]
    Sequence Number: 199    (relative sequence number)
    Sequence Number (raw): 1710345914
    [Next Sequence Number: 1520    (relative sequence number)]
    Acknowledgment Number: 182    (relative ack number)
    Acknowledgment number (raw): 276393585
    1000 .... = Header Length: 32 bytes (8)
    Flags: 0x019 (FIN, PSH, ACK)
    Window: 50499
    [Calculated window size: 50499]
    [Window size scaling factor: 1]
    Checksum: 0x0538 [unverified]
    [Checksum Status: Unverified]
    Urgent Pointer: 0
    Options: (12 bytes), No-Operation (NOP), No-Operation (NOP), Timestamps
    [Timestamps]
    [SEQ/ACK analysis]
    TCP payload (1320 bytes)
    TCP segment data (1320 bytes)
[2 Reassembled TCP Segments (1518 bytes): #54(198), #55(1320)]
Hypertext Transfer Protocol
Media Type

No.     Time           Source                Destination           Protocol Length Info
     63 5.337437237    10.3.141.125          192.168.8.120         HTTP     242    GET /?custom=1&cmd=3014 HTTP/1.1 

Frame 63: 242 bytes on wire (1936 bits), 242 bytes captured (1936 bits) on interface wlan0, id 0
Ethernet II, Src: Apple_a6:df:21 (68:83:cb:a6:df:21), Dst: RaspberryPiF_89:0f:fc (b8:27:eb:89:0f:fc)
Internet Protocol Version 4, Src: 10.3.141.125 (10.3.141.125), Dst: 192.168.8.120 (192.168.8.120)
    0100 .... = Version: 4
    .... 0101 = Header Length: 20 bytes (5)
    Differentiated Services Field: 0x02 (DSCP: CS0, ECN: ECT(0))
        0000 00.. = Differentiated Services Codepoint: Default (0)
        .... ..10 = Explicit Congestion Notification: ECN-Capable Transport codepoint '10' (2)
    Total Length: 228
    Identification: 0x0000 (0)
    010. .... = Flags: 0x2, Don't fragment
    ...0 0000 0000 0000 = Fragment Offset: 0
    Time to Live: 64
    Protocol: TCP (6)
    Header Checksum: 0xd971 [validation disabled]
    [Header checksum status: Unverified]
    Source Address: 10.3.141.125 (10.3.141.125)
    Destination Address: 192.168.8.120 (192.168.8.120)
    [Stream index: 0]
Transmission Control Protocol, Src Port: 53219 (53219), Dst Port: http (80), Seq: 1, Ack: 1, Len: 176
    Source Port: 53219 (53219)
    Destination Port: http (80)
    [Stream index: 5]
    [Conversation completeness: Complete, WITH_DATA (31)]
    [TCP Segment Len: 176]
    Sequence Number: 1    (relative sequence number)
    Sequence Number (raw): 1638398407
    [Next Sequence Number: 177    (relative sequence number)]
    Acknowledgment Number: 1    (relative ack number)
    Acknowledgment number (raw): 2890283057
    1000 .... = Header Length: 32 bytes (8)
    Flags: 0x018 (PSH, ACK)
    Window: 2058
    [Calculated window size: 131712]
    [Window size scaling factor: 64]
    Checksum: 0x7453 [unverified]
    [Checksum Status: Unverified]
    Urgent Pointer: 0
    Options: (12 bytes), No-Operation (NOP), No-Operation (NOP), Timestamps
    [Timestamps]
    [SEQ/ACK analysis]
    TCP payload (176 bytes)
Hypertext Transfer Protocol
    GET /?custom=1&cmd=3014 HTTP/1.1\r\n
    Host: 192.168.8.120\r\n
    User-Agent: WILDLIFE CAM 1.0.8 rv:25010602 (iPhone; iOS 18.3.1; en_US)\r\n
    Connection: keep-alive\r\n
    Accept-Encoding: gzip\r\n
    \r\n
    [Response in frame: 67]
    [Full request URI: http://192.168.8.120/?custom=1&cmd=3014]

No.     Time           Source                Destination           Protocol Length Info
     67 5.362828383    192.168.8.120         10.3.141.125          HTTP     1116   HTTP/1.1 200 OK  (text/xml)

Frame 67: 1116 bytes on wire (8928 bits), 1116 bytes captured (8928 bits) on interface wlan0, id 0
Ethernet II, Src: RaspberryPiF_89:0f:fc (b8:27:eb:89:0f:fc), Dst: Apple_a6:df:21 (68:83:cb:a6:df:21)
Internet Protocol Version 4, Src: 192.168.8.120 (192.168.8.120), Dst: 10.3.141.125 (10.3.141.125)
    0100 .... = Version: 4
    .... 0101 = Header Length: 20 bytes (5)
    Differentiated Services Field: 0x02 (DSCP: CS0, ECN: ECT(0))
        0000 00.. = Differentiated Services Codepoint: Default (0)
        .... ..10 = Explicit Congestion Notification: ECN-Capable Transport codepoint '10' (2)
    Total Length: 1102
    Identification: 0xc8cd (51405)
    010. .... = Flags: 0x2, Don't fragment
    ...0 0000 0000 0000 = Fragment Offset: 0
    Time to Live: 63
    Protocol: TCP (6)
    Header Checksum: 0x0e3a [validation disabled]
    [Header checksum status: Unverified]
    Source Address: 192.168.8.120 (192.168.8.120)
    Destination Address: 10.3.141.125 (10.3.141.125)
    [Stream index: 0]
Transmission Control Protocol, Src Port: http (80), Dst Port: 53219 (53219), Seq: 199, Ack: 177, Len: 1050
    Source Port: http (80)
    Destination Port: 53219 (53219)
    [Stream index: 5]
    [Conversation completeness: Complete, WITH_DATA (31)]
    [TCP Segment Len: 1050]
    Sequence Number: 199    (relative sequence number)
    Sequence Number (raw): 2890283255
    [Next Sequence Number: 1250    (relative sequence number)]
    Acknowledgment Number: 177    (relative ack number)
    Acknowledgment number (raw): 1638398583
    1000 .... = Header Length: 32 bytes (8)
    Flags: 0x019 (FIN, PSH, ACK)
    Window: 50504
    [Calculated window size: 50504]
    [Window size scaling factor: 1]
    Checksum: 0xa46c [unverified]
    [Checksum Status: Unverified]
    Urgent Pointer: 0
    Options: (12 bytes), No-Operation (NOP), No-Operation (NOP), Timestamps
    [Timestamps]
    [SEQ/ACK analysis]
    TCP payload (1050 bytes)
    TCP segment data (1050 bytes)
[2 Reassembled TCP Segments (1248 bytes): #65(198), #67(1050)]
Hypertext Transfer Protocol
Media Type

No.     Time           Source                Destination           Protocol Length Info
     74 6.479459997    10.3.141.125          192.168.8.120         HTTP     242    GET /?custom=1&cmd=2016 HTTP/1.1 

Frame 74: 242 bytes on wire (1936 bits), 242 bytes captured (1936 bits) on interface wlan0, id 0
Ethernet II, Src: Apple_a6:df:21 (68:83:cb:a6:df:21), Dst: RaspberryPiF_89:0f:fc (b8:27:eb:89:0f:fc)
Internet Protocol Version 4, Src: 10.3.141.125 (10.3.141.125), Dst: 192.168.8.120 (192.168.8.120)
    0100 .... = Version: 4
    .... 0101 = Header Length: 20 bytes (5)
    Differentiated Services Field: 0x02 (DSCP: CS0, ECN: ECT(0))
        0000 00.. = Differentiated Services Codepoint: Default (0)
        .... ..10 = Explicit Congestion Notification: ECN-Capable Transport codepoint '10' (2)
    Total Length: 228
    Identification: 0x0000 (0)
    010. .... = Flags: 0x2, Don't fragment
    ...0 0000 0000 0000 = Fragment Offset: 0
    Time to Live: 64
    Protocol: TCP (6)
    Header Checksum: 0xd971 [validation disabled]
    [Header checksum status: Unverified]
    Source Address: 10.3.141.125 (10.3.141.125)
    Destination Address: 192.168.8.120 (192.168.8.120)
    [Stream index: 0]
Transmission Control Protocol, Src Port: 53221 (53221), Dst Port: http (80), Seq: 1, Ack: 1, Len: 176
    Source Port: 53221 (53221)
    Destination Port: http (80)
    [Stream index: 6]
    [Conversation completeness: Complete, WITH_DATA (31)]
    [TCP Segment Len: 176]
    Sequence Number: 1    (relative sequence number)
    Sequence Number (raw): 3296184832
    [Next Sequence Number: 177    (relative sequence number)]
    Acknowledgment Number: 1    (relative ack number)
    Acknowledgment number (raw): 2385447237
    1000 .... = Header Length: 32 bytes (8)
    Flags: 0x018 (PSH, ACK)
    Window: 2058
    [Calculated window size: 131712]
    [Window size scaling factor: 64]
    Checksum: 0x7b74 [unverified]
    [Checksum Status: Unverified]
    Urgent Pointer: 0
    Options: (12 bytes), No-Operation (NOP), No-Operation (NOP), Timestamps
    [Timestamps]
    [SEQ/ACK analysis]
    TCP payload (176 bytes)
Hypertext Transfer Protocol
    GET /?custom=1&cmd=2016 HTTP/1.1\r\n
    Host: 192.168.8.120\r\n
    User-Agent: WILDLIFE CAM 1.0.8 rv:25010602 (iPhone; iOS 18.3.1; en_US)\r\n
    Connection: keep-alive\r\n
    Accept-Encoding: gzip\r\n
    \r\n
    [Response in frame: 77]
    [Full request URI: http://192.168.8.120/?custom=1&cmd=2016]

No.     Time           Source                Destination           Protocol Length Info
     77 6.492281403    192.168.8.120         10.3.141.125          HTTP     180    HTTP/1.1 200 OK  (text/xml)

Frame 77: 180 bytes on wire (1440 bits), 180 bytes captured (1440 bits) on interface wlan0, id 0
Ethernet II, Src: RaspberryPiF_89:0f:fc (b8:27:eb:89:0f:fc), Dst: Apple_a6:df:21 (68:83:cb:a6:df:21)
Internet Protocol Version 4, Src: 192.168.8.120 (192.168.8.120), Dst: 10.3.141.125 (10.3.141.125)
    0100 .... = Version: 4
    .... 0101 = Header Length: 20 bytes (5)
    Differentiated Services Field: 0x02 (DSCP: CS0, ECN: ECT(0))
        0000 00.. = Differentiated Services Codepoint: Default (0)
        .... ..10 = Explicit Congestion Notification: ECN-Capable Transport codepoint '10' (2)
    Total Length: 166
    Identification: 0x357b (13691)
    010. .... = Flags: 0x2, Don't fragment
    ...0 0000 0000 0000 = Fragment Offset: 0
    Time to Live: 63
    Protocol: TCP (6)
    Header Checksum: 0xa534 [validation disabled]
    [Header checksum status: Unverified]
    Source Address: 192.168.8.120 (192.168.8.120)
    Destination Address: 10.3.141.125 (10.3.141.125)
    [Stream index: 0]
Transmission Control Protocol, Src Port: http (80), Dst Port: 53221 (53221), Seq: 198, Ack: 177, Len: 114
    Source Port: http (80)
    Destination Port: 53221 (53221)
    [Stream index: 6]
    [Conversation completeness: Complete, WITH_DATA (31)]
    [TCP Segment Len: 114]
    Sequence Number: 198    (relative sequence number)
    Sequence Number (raw): 2385447434
    [Next Sequence Number: 313    (relative sequence number)]
    Acknowledgment Number: 177    (relative ack number)
    Acknowledgment number (raw): 3296185008
    1000 .... = Header Length: 32 bytes (8)
    Flags: 0x019 (FIN, PSH, ACK)
    Window: 50504
    [Calculated window size: 50504]
    [Window size scaling factor: 1]
    Checksum: 0x4efb [unverified]
    [Checksum Status: Unverified]
    Urgent Pointer: 0
    Options: (12 bytes), No-Operation (NOP), No-Operation (NOP), Timestamps
    [Timestamps]
    [SEQ/ACK analysis]
    TCP payload (114 bytes)
    TCP segment data (114 bytes)
[2 Reassembled TCP Segments (311 bytes): #76(197), #77(114)]
Hypertext Transfer Protocol
Media Type

No.     Time           Source                Destination           Protocol Length Info
     91 17.202151503   10.3.141.125          192.168.8.120         HTTP     248    GET /?custom=1&cmd=3001&par=2 HTTP/1.1 

Frame 91: 248 bytes on wire (1984 bits), 248 bytes captured (1984 bits) on interface wlan0, id 0
Ethernet II, Src: Apple_a6:df:21 (68:83:cb:a6:df:21), Dst: RaspberryPiF_89:0f:fc (b8:27:eb:89:0f:fc)
Internet Protocol Version 4, Src: 10.3.141.125 (10.3.141.125), Dst: 192.168.8.120 (192.168.8.120)
    0100 .... = Version: 4
    .... 0101 = Header Length: 20 bytes (5)
    Differentiated Services Field: 0x00 (DSCP: CS0, ECN: Not-ECT)
        0000 00.. = Differentiated Services Codepoint: Default (0)
        .... ..00 = Explicit Congestion Notification: Not ECN-Capable Transport (0)
    Total Length: 234
    Identification: 0x0000 (0)
    010. .... = Flags: 0x2, Don't fragment
    ...0 0000 0000 0000 = Fragment Offset: 0
    Time to Live: 64
    Protocol: TCP (6)
    Header Checksum: 0xd96d [validation disabled]
    [Header checksum status: Unverified]
    Source Address: 10.3.141.125 (10.3.141.125)
    Destination Address: 192.168.8.120 (192.168.8.120)
    [Stream index: 0]
Transmission Control Protocol, Src Port: 53223 (53223), Dst Port: http (80), Seq: 1, Ack: 1, Len: 182
    Source Port: 53223 (53223)
    Destination Port: http (80)
    [Stream index: 7]
    [Conversation completeness: Complete, WITH_DATA (31)]
    [TCP Segment Len: 182]
    Sequence Number: 1    (relative sequence number)
    Sequence Number (raw): 2082140728
    [Next Sequence Number: 183    (relative sequence number)]
    Acknowledgment Number: 1    (relative ack number)
    Acknowledgment number (raw): 3595516193
    1000 .... = Header Length: 32 bytes (8)
    Flags: 0x018 (PSH, ACK)
    Window: 2058
    [Calculated window size: 131712]
    [Window size scaling factor: 64]
    Checksum: 0x8f6b [unverified]
    [Checksum Status: Unverified]
    Urgent Pointer: 0
    Options: (12 bytes), No-Operation (NOP), No-Operation (NOP), Timestamps
    [Timestamps]
    [SEQ/ACK analysis]
    TCP payload (182 bytes)
Hypertext Transfer Protocol
    GET /?custom=1&cmd=3001&par=2 HTTP/1.1\r\n
    Host: 192.168.8.120\r\n
    User-Agent: WILDLIFE CAM 1.0.8 rv:25010602 (iPhone; iOS 18.3.1; en_US)\r\n
    Connection: keep-alive\r\n
    Accept-Encoding: gzip\r\n
    \r\n
    [Response in frame: 108]
    [Full request URI: http://192.168.8.120/?custom=1&cmd=3001&par=2]

No.     Time           Source                Destination           Protocol Length Info
    108 17.706618639   192.168.8.120         10.3.141.125          HTTP     163    HTTP/1.1 200 OK  (text/xml)

Frame 108: 163 bytes on wire (1304 bits), 163 bytes captured (1304 bits) on interface wlan0, id 0
Ethernet II, Src: RaspberryPiF_89:0f:fc (b8:27:eb:89:0f:fc), Dst: Apple_a6:df:21 (68:83:cb:a6:df:21)
Internet Protocol Version 4, Src: 192.168.8.120 (192.168.8.120), Dst: 10.3.141.125 (10.3.141.125)
    0100 .... = Version: 4
    .... 0101 = Header Length: 20 bytes (5)
    Differentiated Services Field: 0x02 (DSCP: CS0, ECN: ECT(0))
        0000 00.. = Differentiated Services Codepoint: Default (0)
        .... ..10 = Explicit Congestion Notification: ECN-Capable Transport codepoint '10' (2)
    Total Length: 149
    Identification: 0x516a (20842)
    010. .... = Flags: 0x2, Don't fragment
    ...0 0000 0000 0000 = Fragment Offset: 0
    Time to Live: 63
    Protocol: TCP (6)
    Header Checksum: 0x8956 [validation disabled]
    [Header checksum status: Unverified]
    Source Address: 192.168.8.120 (192.168.8.120)
    Destination Address: 10.3.141.125 (10.3.141.125)
    [Stream index: 0]
Transmission Control Protocol, Src Port: http (80), Dst Port: 53223 (53223), Seq: 197, Ack: 183, Len: 97
    Source Port: http (80)
    Destination Port: 53223 (53223)
    [Stream index: 7]
    [Conversation completeness: Complete, WITH_DATA (31)]
    [TCP Segment Len: 97]
    Sequence Number: 197    (relative sequence number)
    Sequence Number (raw): 3595516389
    [Next Sequence Number: 295    (relative sequence number)]
    Acknowledgment Number: 183    (relative ack number)
    Acknowledgment number (raw): 2082140910
    1000 .... = Header Length: 32 bytes (8)
    Flags: 0x019 (FIN, PSH, ACK)
    Window: 50498
    [Calculated window size: 50498]
    [Window size scaling factor: 1]
    Checksum: 0xe125 [unverified]
    [Checksum Status: Unverified]
    Urgent Pointer: 0
    Options: (12 bytes), No-Operation (NOP), No-Operation (NOP), Timestamps
    [Timestamps]
    [SEQ/ACK analysis]
    TCP payload (97 bytes)
    TCP segment data (97 bytes)
[2 Reassembled TCP Segments (293 bytes): #107(196), #108(97)]
Hypertext Transfer Protocol
Media Type

No.     Time           Source                Destination           Protocol Length Info
    116 19.625738221   10.3.141.125          192.168.8.120         HTTP     229    GET /DCIM/ HTTP/1.1 

Frame 116: 229 bytes on wire (1832 bits), 229 bytes captured (1832 bits) on interface wlan0, id 0
Ethernet II, Src: Apple_a6:df:21 (68:83:cb:a6:df:21), Dst: RaspberryPiF_89:0f:fc (b8:27:eb:89:0f:fc)
Internet Protocol Version 4, Src: 10.3.141.125 (10.3.141.125), Dst: 192.168.8.120 (192.168.8.120)
    0100 .... = Version: 4
    .... 0101 = Header Length: 20 bytes (5)
    Differentiated Services Field: 0x02 (DSCP: CS0, ECN: ECT(0))
        0000 00.. = Differentiated Services Codepoint: Default (0)
        .... ..10 = Explicit Congestion Notification: ECN-Capable Transport codepoint '10' (2)
    Total Length: 215
    Identification: 0x0000 (0)
    010. .... = Flags: 0x2, Don't fragment
    ...0 0000 0000 0000 = Fragment Offset: 0
    Time to Live: 64
    Protocol: TCP (6)
    Header Checksum: 0xd97e [validation disabled]
    [Header checksum status: Unverified]
    Source Address: 10.3.141.125 (10.3.141.125)
    Destination Address: 192.168.8.120 (192.168.8.120)
    [Stream index: 0]
Transmission Control Protocol, Src Port: 53224 (53224), Dst Port: http (80), Seq: 1, Ack: 1, Len: 163
    Source Port: 53224 (53224)
    Destination Port: http (80)
    [Stream index: 8]
    [Conversation completeness: Complete, WITH_DATA (31)]
    [TCP Segment Len: 163]
    Sequence Number: 1    (relative sequence number)
    Sequence Number (raw): 2116491186
    [Next Sequence Number: 164    (relative sequence number)]
    Acknowledgment Number: 1    (relative ack number)
    Acknowledgment number (raw): 3756862688
    1000 .... = Header Length: 32 bytes (8)
    Flags: 0x018 (PSH, ACK)
    Window: 2058
    [Calculated window size: 131712]
    [Window size scaling factor: 64]
    Checksum: 0x05d5 [unverified]
    [Checksum Status: Unverified]
    Urgent Pointer: 0
    Options: (12 bytes), No-Operation (NOP), No-Operation (NOP), Timestamps
    [Timestamps]
    [SEQ/ACK analysis]
