 $ sudo tshark -i wlan0 -f "tcp port 80" -Y "http" -l 
Running as user "root" and group "root". This could be dangerous.
Capturing on 'wlan0'
 ** (tshark:1917) 12:50:30.284972 [Main MESSAGE] -- Capture started.
 ** (tshark:1917) 12:50:30.285483 [Main MESSAGE] -- File: "/tmp/wireshark_wlan0DBQ812.pcapng"
  127 0.763264478 192.168.8.120 → 10.3.141.125 TCP 1514 80 → 61632 [ACK] Seq=41993 Ack=1 Win=50440 Len=1448 TSval=2979912506 TSecr=1095299054
  153 1.829456509  10.3.141.76 → 10.3.141.1   HTTP 141 POST /ajax/session/do_check_session.php HTTP/1.1  (application/x-www-form-urlencoded)
  155 1.832528593   10.3.141.1 → 10.3.141.76  HTTP/JSON 388 HTTP/1.1 200 OK , JavaScript Object Notation (application/json)
  215 3.396019217 192.168.8.120 → 10.3.141.125 TCP 1514 80 → 61632 [ACK] Seq=73849 Ack=1 Win=50440 Len=1448 TSval=2979915126 TSecr=1095301674
  229 3.457504529 192.168.8.120 → 10.3.141.125 TCP 1514 80 → 61807 [ACK] Seq=86881 Ack=1 Win=50440 Len=1448 TSval=2979915157 TSecr=3964636298
  260 3.706907238 192.168.8.120 → 10.3.141.125 TCP 1514 80 → 61807 [ACK] Seq=98465 Ack=1 Win=50440 Len=1448 TSval=2979915308 TSecr=3964636445
  268 3.749642967 192.168.8.120 → 10.3.141.125 TCP 1514 80 → 61807 [ACK] Seq=102809 Ack=1 Win=50440 Len=1448 TSval=2979915335 TSecr=3964636475
  291 3.840919946 192.168.8.120 → 10.3.141.125 TCP 1514 80 → 61807 [ACK] Seq=111497 Ack=1 Win=50440 Len=1448 TSval=2979915533 TSecr=3964636675
  293 3.850014113 192.168.8.120 → 10.3.141.125 TCP 1514 80 → 61807 [ACK] Seq=112945 Ack=1 Win=50440 Len=1448 TSval=2979915534 TSecr=3964636675
  297 3.882710102 192.168.8.120 → 10.3.141.125 TCP 1514 80 → 61632 [ACK] Seq=107153 Ack=1 Win=50440 Len=1448 TSval=2979915739 TSecr=1095302108
  332 4.059613592 192.168.8.120 → 10.3.141.125 TCP 1514 80 → 61632 [ACK] Seq=120185 Ack=1 Win=50440 Len=1448 TSval=2979915744 TSecr=1095302279
  337 4.075160727 192.168.8.120 → 10.3.141.125 TCP 1514 80 → 61807 [ACK] Seq=131769 Ack=1 Win=50440 Len=1448 TSval=2979915765 TSecr=3964636903
  379 4.220361873 192.168.8.120 → 10.3.141.125 TCP 1514 80 → 61632 [ACK] Seq=143353 Ack=1 Win=50440 Len=1448 TSval=2979915981 TSecr=1095302527
  384 4.245879269 192.168.8.120 → 10.3.141.125 TCP 1514 80 → 61807 [ACK] Seq=150593 Ack=1 Win=50440 Len=1448 TSval=2979915982 TSecr=3964637118
  396 4.325413696 192.168.8.120 → 10.3.141.125 TCP 1514 80 → 61632 [ACK] Seq=146249 Ack=1 Win=50440 Len=1448 TSval=2979915983 TSecr=1095302534
  419 4.428694946 192.168.8.120 → 10.3.141.125 TCP 1514 80 → 61632 [ACK] Seq=159281 Ack=1 Win=50440 Len=1448 TSval=2979916072 TSecr=1095302623
  465 4.634001873 192.168.8.120 → 10.3.141.125 TCP 1514 80 → 61632 [ACK] Seq=175209 Ack=1 Win=50440 Len=1448 TSval=2979916289 TSecr=1095302837
  473 4.670337810 192.168.8.120 → 10.3.141.125 TCP 1514 80 → 61632 [ACK] Seq=182449 Ack=1 Win=50440 Len=1448 TSval=2979916344 TSecr=1095302885
  508 4.841507289 192.168.8.120 → 10.3.141.125 TCP 1514 80 → 61807 [ACK] Seq=211409 Ack=1 Win=50440 Len=1448 TSval=2979916453 TSecr=3964637595
  536 4.969727966 192.168.8.120 → 10.3.141.125 TCP 1514 80 → 61807 [ACK] Seq=218649 Ack=1 Win=50440 Len=1448 TSval=2979916586 TSecr=3964637716
  597 5.206674164 192.168.8.120 → 10.3.141.125 TCP 1514 80 → 61807 [ACK] Seq=246161 Ack=1 Win=50440 Len=1448 TSval=2979916846 TSecr=3964637985
  626 6.162811924 192.168.8.120 → 10.3.141.125 TCP 1514 80 → 61807 [ACK] Seq=260641 Ack=1 Win=50440 Len=1448 TSval=2979916944 TSecr=3964638087
  634 6.834457289  10.3.141.76 → 10.3.141.1   HTTP 141 POST /ajax/session/do_check_session.php HTTP/1.1  (application/x-www-form-urlencoded)
  637 6.837017184   10.3.141.1 → 10.3.141.76  HTTP/JSON 388 HTTP/1.1 200 OK , JavaScript Object Notation (application/json)
  666 7.539600934 192.168.8.120 → 10.3.141.125 TCP 1514 80 → 61632 [ACK] Seq=256297 Ack=1 Win=50440 Len=1448 TSval=2979917165 TSecr=1095303608
  669 7.545973590 192.168.8.120 → 10.3.141.125 TCP 1514 80 → 61807 [ACK] Seq=273673 Ack=1 Win=50440 Len=1448 TSval=2979917167 TSecr=3964638216
  696 7.641714997 192.168.8.120 → 10.3.141.125 TCP 1514 80 → 61807 [ACK] Seq=289601 Ack=1 Win=50440 Len=1448 TSval=2979917259 TSecr=3964638363
  724 7.757358278 192.168.8.120 → 10.3.141.125 TCP 1514 80 → 61807 [ACK] Seq=304081 Ack=1 Win=50440 Len=1448 TSval=2979919239 TSecr=3964639977
  738 7.804457236 192.168.8.120 → 10.3.141.125 TCP 1514 80 → 61632 [ACK] Seq=278017 Ack=1 Win=50440 Len=1448 TSval=2979919272 TSecr=1095305823
  742 7.825409997 192.168.8.120 → 10.3.141.125 TCP 1514 80 → 61632 [ACK] Seq=280913 Ack=1 Win=50440 Len=1448 TSval=2979919409 TSecr=1095305943
  765 7.934435830 192.168.8.120 → 10.3.141.125 TCP 1514 80 → 61807 [ACK] Seq=311321 Ack=1 Win=50440 Len=1448 TSval=2979919444 TSecr=3964640565
  790 8.460697705 192.168.8.120 → 10.3.141.125 TCP 1514 80 → 61807 [ACK] Seq=333041 Ack=1 Win=50440 Len=1448 TSval=2979919496 TSecr=3964640638
  808 8.525717809 192.168.8.120 → 10.3.141.125 TCP 1514 80 → 61632 [ACK] Seq=306977 Ack=1 Win=50440 Len=1448 TSval=2979919560 TSecr=1095306104
  809 8.534120934 192.168.8.120 → 10.3.141.125 TCP 1514 80 → 61632 [ACK] Seq=308425 Ack=1 Win=50440 Len=1448 TSval=2979919560 TSecr=1095306104
  811 8.551033069 192.168.8.120 → 10.3.141.125 TCP 1514 80 → 61632 [ACK] Seq=309873 Ack=1 Win=50440 Len=1448 TSval=2979919560 TSecr=1095306104
  837 8.674032809 192.168.8.120 → 10.3.141.125 TCP 1514 80 → 61807 [ACK] Seq=359105 Ack=1 Win=50440 Len=1448 TSval=2979919639 TSecr=3964640779
  857 9.174569527 192.168.8.120 → 10.3.141.125 TCP 1514 80 → 61632 [ACK] Seq=324353 Ack=1 Win=50440 Len=1448 TSval=2979919698 TSecr=1095306245
  862 9.851696142 192.168.8.120 → 10.3.141.125 TCP 1514 80 → 61632 [ACK] Seq=328697 Ack=1 Win=50440 Len=1448 TSval=2979919698 TSecr=1095306245
  867 10.613042131 192.168.8.120 → 10.3.141.125 TCP 1514 80 → 61632 [ACK] Seq=331593 Ack=1 Win=50440 Len=1448 TSval=2979919698 TSecr=1095306245
  887 11.616812547 192.168.8.120 → 10.3.141.125 TCP 1514 80 → 61632 [ACK] Seq=346073 Ack=1 Win=50440 Len=1448 TSval=2979919754 TSecr=1095306298
  912 11.702036558 192.168.8.120 → 10.3.141.125 TCP 1514 80 → 61807 [ACK] Seq=376481 Ack=1 Win=50440 Len=1448 TSval=2979919916 TSecr=3964640979
  941 11.833597183  10.3.141.76 → 10.3.141.1   HTTP 141 POST /ajax/session/do_check_session.php HTTP/1.1  (application/x-www-form-urlencoded)
  943 11.836378433   10.3.141.1 → 10.3.141.76  HTTP/JSON 388 HTTP/1.1 200 OK , JavaScript Object Notation (application/json)
  948 11.851350776 192.168.8.120 → 10.3.141.125 TCP 1514 80 → 61632 [ACK] Seq=367793 Ack=1 Win=50440 Len=1448 TSval=2979920413 TSecr=1095306962
  996 12.057342964 192.168.8.120 → 10.3.141.125 TCP 1514 80 → 61632 [ACK] Seq=406889 Ack=1 Win=50440 Len=1448 TSval=2979923514 TSecr=1095310049
 1000 12.084987755 192.168.8.120 → 10.3.141.125 TCP 1514 80 → 61632 [ACK] Seq=412681 Ack=1 Win=50440 Len=1448 TSval=2979923515 TSecr=1095310049
 1016 12.158305255 192.168.8.120 → 10.3.141.125 TCP 1514 80 → 61632 [ACK] Seq=434401 Ack=1 Win=50440 Len=1448 TSval=2979923656 TSecr=1095310097
 1017 12.164947599 192.168.8.120 → 10.3.141.125 TCP 1514 80 → 61632 [ACK] Seq=435849 Ack=1 Win=50440 Len=1448 TSval=2979923656 TSecr=1095310097
 1019 12.169635672 192.168.8.120 → 10.3.141.125 TCP 1514 80 → 61807 [ACK] Seq=435849 Ack=1 Win=50440 Len=1448 TSval=2979923843 TSecr=3964644766
 1036 12.258852964 192.168.8.120 → 10.3.141.125 TCP 1514 80 → 61807 [ACK] Seq=457569 Ack=1 Win=50440 Len=1448 TSval=2979923845 TSecr=3964644766
 1043 12.276986557 192.168.8.120 → 10.3.141.125 TCP 1514 80 → 61807 [ACK] Seq=467705 Ack=1 Win=50440 Len=1448 TSval=2979923845 TSecr=3964644766
 1048 12.287749318 192.168.8.120 → 10.3.141.125 TCP 1514 80 → 61807 [ACK] Seq=474945 Ack=1 Win=50440 Len=1448 TSval=2979923846 TSecr=3964644766
 1052 12.313492859 192.168.8.120 → 10.3.141.125 TCP 1514 80 → 61807 [ACK] Seq=479289 Ack=1 Win=50440 Len=1448 TSval=2979924101 TSecr=3964644840
 1053 12.317866349 192.168.8.120 → 10.3.141.125 TCP 1514 80 → 61807 [ACK] Seq=480737 Ack=1 Win=50440 Len=1448 TSval=2979924101 TSecr=3964644840
 1054 12.332135047 192.168.8.120 → 10.3.141.125 TCP 1514 80 → 61807 [ACK] Seq=482185 Ack=1 Win=50440 Len=1448 TSval=2979924101 TSecr=3964644840
 1058 12.393737599 192.168.8.120 → 10.3.141.125 TCP 1514 80 → 61807 [ACK] Seq=485081 Ack=1 Win=50440 Len=1448 TSval=2979924112 TSecr=3964644841
 1197 16.837424316  10.3.141.76 → 10.3.141.1   HTTP 141 POST /ajax/session/do_check_session.php HTTP/1.1  (application/x-www-form-urlencoded)
 1199 16.839856608   10.3.141.1 → 10.3.141.76  HTTP/JSON 388 HTTP/1.1 200 OK , JavaScript Object Notation (application/json)
 1289 18.449882336 192.168.8.120 → 10.3.141.125 TCP 1514 80 → 61632 [ACK] Seq=486529 Ack=1 Win=50440 Len=1448 TSval=2979926774 TSecr=1095313291
 1362 18.938025096 192.168.8.120 → 10.3.141.125 TCP 1514 80 → 61632 [ACK] Seq=515489 Ack=1 Win=50440 Len=1448 TSval=2979930216 TSecr=1095316755
 1364 19.008584211 192.168.8.120 → 10.3.141.125 TCP 1514 80 → 61632 [ACK] Seq=516937 Ack=1 Win=50440 Len=1448 TSval=2979930216 TSecr=1095316755
 1390 19.192367336 192.168.8.120 → 10.3.141.125 TCP 1514 80 → 61632 [PSH, ACK] Seq=537209 Ack=1 Win=50440 Len=1448 TSval=2979930314 TSecr=1095316847
 1403 19.400877700 192.168.8.120 → 10.3.141.125 TCP 1514 80 → 61807 [ACK, CWR] Seq=496665 Ack=1 Win=50440 Len=1448 TSval=2979930501 TSecr=3964651623
 1456 20.146352179 192.168.8.120 → 10.3.141.125 TCP 1514 80 → 61632 [ACK] Seq=571961 Ack=1 Win=50440 Len=1448 TSval=2979930802 TSecr=1095317348
 1466 20.196787023 192.168.8.120 → 10.3.141.125 TCP 1514 80 → 61807 [ACK] Seq=515489 Ack=1 Win=50440 Len=1448 TSval=2979930802 TSecr=3964651901
 1499 20.431525044 192.168.8.120 → 10.3.141.125 TCP 1514 80 → 61632 [ACK] Seq=595129 Ack=1 Win=50440 Len=1448 TSval=2979931038 TSecr=1095317588
 1527 20.940771606 192.168.8.120 → 10.3.141.125 TCP 1514 80 → 61632 [ACK] Seq=608161 Ack=1 Win=50440 Len=1448 TSval=2979931793 TSecr=1095318339
 1554 21.036486242 192.168.8.120 → 10.3.141.125 TCP 1514 80 → 61632 [ACK] Seq=624089 Ack=1 Win=50440 Len=1448 TSval=2979931858 TSecr=1095318405
 1574 21.129108012 192.168.8.120 → 10.3.141.125 TCP 1514 80 → 61632 [ACK] Seq=635673 Ack=1 Win=50440 Len=1448 TSval=2979932001 TSecr=1095318466
 1586 21.173764158 192.168.8.120 → 10.3.141.125 TCP 1514 80 → 61632 [ACK] Seq=638569 Ack=1 Win=50440 Len=1448 TSval=2979932093 TSecr=1095318579
 1591 21.204877856 192.168.8.120 → 10.3.141.125 TCP 1514 80 → 61807 [ACK] Seq=548793 Ack=1 Win=50440 Len=1448 TSval=2979932099 TSecr=3964653238
 1618 21.368227543 192.168.8.120 → 10.3.141.125 TCP 1514 80 → 61632 [ACK] Seq=657393 Ack=1 Win=50440 Len=1448 TSval=2979932240 TSecr=1095318786
 1628 21.399184991 192.168.8.120 → 10.3.141.125 TCP 1514 80 → 61632 [ACK] Seq=664633 Ack=1 Win=50440 Len=1448 TSval=2979932318 TSecr=1095318856
 1666 21.676767127 192.168.8.120 → 10.3.141.125 TCP 1514 80 → 61632 [ACK] Seq=683457 Ack=1 Win=50440 Len=1448 TSval=2979932829 TSecr=1095319365
 1683 21.736515564 192.168.8.120 → 10.3.141.125 TCP 1514 80 → 61807 [ACK] Seq=576305 Ack=1 Win=50440 Len=1448 TSval=2979932945 TSecr=3964654081
 1706 21.822167127 192.168.8.120 → 10.3.141.125 TCP 1514 80 → 61632 [ACK] Seq=696729 Ack=1 Win=50440 Len=1448 TSval=2979933011 TSecr=1095319553
 1711 21.833110981  10.3.141.76 → 10.3.141.1   HTTP 141 POST /ajax/session/do_check_session.php HTTP/1.1  (application/x-www-form-urlencoded)
 1713 21.835777595   10.3.141.1 → 10.3.141.76  HTTP/JSON 388 HTTP/1.1 200 OK , JavaScript Object Notation (application/json)
 1727 21.972766866 192.168.8.120 → 10.3.141.125 TCP 1514 80 → 61632 [ACK] Seq=708313 Ack=1 Win=50440 Len=1448 TSval=2979933012 TSecr=1095319553
 1796 26.314905719 192.168.8.120 → 10.3.141.125 TCP 1514 80 → 61632 [ACK] Seq=731481 Ack=1 Win=50440 Len=1448 TSval=2979933422 TSecr=1095319962
 1798 26.320002542 192.168.8.120 → 10.3.141.125 TCP 1514 80 → 61632 [ACK] Seq=732929 Ack=1 Win=50440 Len=1448 TSval=2979933450 TSecr=1095319972
 1800 26.330973687 192.168.8.120 → 10.3.141.125 TCP 1514 80 → 61632 [ACK] Seq=734377 Ack=1 Win=50440 Len=1448 TSval=2979933451 TSecr=1095319977
 1802 26.335972281 192.168.8.120 → 10.3.141.125 TCP 1514 80 → 61807 [ACK] Seq=606713 Ack=1 Win=50440 Len=1448 TSval=2979933502 TSecr=3964654635
 1815 26.420022958 192.168.8.120 → 10.3.141.125 TCP 1514 80 → 61807 [ACK] Seq=609609 Ack=1 Win=50440 Len=1448 TSval=2979933514 TSecr=3964654654
 1860 26.616543739 192.168.8.120 → 10.3.141.125 TCP 1514 80 → 61632 [ACK] Seq=747409 Ack=1 Win=50440 Len=1448 TSval=2979933674 TSecr=1095320222
 1871 26.704561812 192.168.8.120 → 10.3.141.125 TCP 1514 80 → 61632 [ACK] Seq=751753 Ack=1 Win=50440 Len=1448 TSval=2979933761 TSecr=1095320309
 1876 26.718572958 192.168.8.120 → 10.3.141.125 TCP 1514 80 → 61807 [ACK] Seq=648705 Ack=1 Win=50440 Len=1448 TSval=2979934001 TSecr=3964655126
 1891 26.756699469 10.3.141.125 → 192.168.8.120 HTTP 248 GET /?custom=1&cmd=3001&par=2 HTTP/1.1 
 1906 26.795977385 192.168.8.120 → 10.3.141.125 TCP 1514 80 → 61807 [ACK] Seq=663185 Ack=1 Win=50440 Len=1448 TSval=2979936454 TSecr=3964656783
 1912 26.812020562 192.168.8.120 → 10.3.141.125 TCP 1514 80 → 61807 [ACK] Seq=667529 Ack=1 Win=50440 Len=1448 TSval=2979936475 TSecr=3964657583
 1921 26.835514364  10.3.141.76 → 10.3.141.1   HTTP 141 POST /ajax/session/do_check_session.php HTTP/1.1  (application/x-www-form-urlencoded)
 1923 26.837961500   10.3.141.1 → 10.3.141.76  HTTP/JSON 388 HTTP/1.1 200 OK , JavaScript Object Notation (application/json)
 1930 26.859966448 192.168.8.120 → 10.3.141.125 TCP 1514 80 → 61632 [ACK] Seq=769129 Ack=1 Win=50440 Len=1448 TSval=2979938069 TSecr=1095324617
 1986 27.188409729 192.168.8.120 → 10.3.141.125 TCP 1514 80 → 61807 [ACK] Seq=687801 Ack=1 Win=50440 Len=1448 TSval=2979938301 TSecr=3964659440
 1988 27.195150145 192.168.8.120 → 10.3.141.125 TCP 1514 80 → 61807 [ACK] Seq=689249 Ack=1 Win=50440 Len=1448 TSval=2979938301 TSecr=3964659440
 1990 27.202210979 192.168.8.120 → 10.3.141.125 TCP 1514 80 → 61807 [ACK] Seq=690697 Ack=1 Win=50440 Len=1448 TSval=2979938308 TSecr=3964659450
 2000 27.322939312 192.168.8.120 → 10.3.141.125 TCP 1514 80 → 61632 [ACK] Seq=799537 Ack=1 Win=50440 Len=1448 TSval=2979938396 TSecr=1095324931
 2020 27.400517854 192.168.8.120 → 10.3.141.125 TCP 1514 80 → 61807 [ACK] Seq=702281 Ack=1 Win=50440 Len=1448 TSval=2979938531 TSecr=3964659667
 2022 27.406571239 192.168.8.120 → 10.3.141.125 TCP 1514 80 → 61807 [ACK] Seq=703729 Ack=1 Win=50440 Len=1448 TSval=2979938531 TSecr=3964659667
 2030 27.430182124 192.168.8.120 → 10.3.141.125 TCP 1514 80 → 61807 [ACK] Seq=709521 Ack=1 Win=50440 Len=1448 TSval=2979938534 TSecr=3964659667
 2034 27.529000197 192.168.8.120 → 10.3.141.125 TCP 1514 80 → 61632 [ACK] Seq=809673 Ack=1 Win=50440 Len=1448 TSval=2979938584 TSecr=1095325134
 2036 27.536136916 192.168.8.120 → 10.3.141.125 TCP 1514 80 → 61807 [ACK] Seq=712417 Ack=1 Win=50440 Len=1448 TSval=2979938604 TSecr=3964659734
 2064 27.664014676 192.168.8.120 → 10.3.141.125 HTTP/XML 163 HTTP/1.1 200 OK 
 2093 27.785961499 192.168.8.120 → 10.3.141.125 TCP 1514 80 → 61807 [ACK] Seq=748617 Ack=1 Win=50440 Len=1448 TSval=2979938867 TSecr=3964659806
 2100 27.822224729 192.168.8.120 → 10.3.141.125 TCP 1514 80 → 61632 [ACK] Seq=824153 Ack=1 Win=50440 Len=1448 TSval=2979938869 TSecr=1095325278
 2106 27.836589572 192.168.8.120 → 10.3.141.125 TCP 1514 80 → 61807 [ACK] Seq=751513 Ack=1 Win=50440 Len=1448 TSval=2979938869 TSecr=3964659823
 2109 27.850232541 192.168.8.120 → 10.3.141.125 TCP 1514 80 → 61807 [ACK] Seq=754409 Ack=1 Win=50440 Len=1448 TSval=2979938869 TSecr=3964659823
 2152 28.028316239 192.168.8.120 → 10.3.141.125 TCP 1514 80 → 61632 [ACK] Seq=847321 Ack=1 Win=50440 Len=1448 TSval=2979938977 TSecr=1095325507
 2176 31.835621446  10.3.141.76 → 10.3.141.1   HTTP 141 POST /ajax/session/do_check_session.php HTTP/1.1  (application/x-www-form-urlencoded)
 2178 31.838151706   10.3.141.1 → 10.3.141.76  HTTP/JSON 388 HTTP/1.1 200 OK , JavaScript Object Notation (application/json)
 2197 32.376728946 192.168.8.120 → 10.3.141.125 TCP 1514 80 → 61807 [ACK] Seq=770337 Ack=1 Win=50440 Len=1448 TSval=2979939468 TSecr=3964660578
 2202 32.443957487 192.168.8.120 → 10.3.141.125 TCP 1514 80 → 61807 [ACK] Seq=774681 Ack=1 Win=50440 Len=1448 TSval=2979939474 TSecr=3964660604
 2226 32.575432956 192.168.8.120 → 10.3.141.125 TCP 1514 80 → 61807 [ACK] Seq=786265 Ack=1 Win=50440 Len=1448 TSval=2979939542 TSecr=3964660648
 2230 32.635206862 192.168.8.120 → 10.3.141.125 TCP 1514 80 → 61807 [ACK] Seq=790609 Ack=1 Win=50440 Len=1448 TSval=2979939542 TSecr=3964660648
 2245 32.690723945 192.168.8.120 → 10.3.141.125 TCP 1514 80 → 61807 [ACK] Seq=802193 Ack=1 Win=50440 Len=1448 TSval=2979939620 TSecr=3964660750
 2251 32.729595664 192.168.8.120 → 10.3.141.125 TCP 1514 80 → 61807 [ACK] Seq=806537 Ack=1 Win=50440 Len=1448 TSval=2979939674 TSecr=3964660795
 2260 32.769788685 192.168.8.120 → 10.3.141.125 TCP 1514 80 → 61632 [ACK] Seq=884969 Ack=1 Win=50440 Len=1448 TSval=2979939702 TSecr=1095326248
 2309 33.080511706 192.168.8.120 → 10.3.141.125 TCP 1514 80 → 61632 [ACK] Seq=895105 Ack=1 Win=50440 Len=1448 TSval=2979939881 TSecr=1095326432
 2321 33.192292799 192.168.8.120 → 10.3.141.125 TCP 1514 80 → 61632 [ACK] Seq=903793 Ack=1 Win=50440 Len=1448 TSval=2979939915 TSecr=1095326464
 2330 33.241150508 192.168.8.120 → 10.3.141.125 TCP 1514 80 → 61632 [ACK] Seq=911033 Ack=1 Win=50440 Len=1448 TSval=2979939916 TSecr=1095326465
 2333 33.250178789 192.168.8.120 → 10.3.141.125 TCP 1514 80 → 61632 [ACK] Seq=913929 Ack=1 Win=50440 Len=1448 TSval=2979939916 TSecr=1095326465
 2340 33.265241758 10.3.141.125 → 192.168.8.120 HTTP 248 GET /?custom=1&cmd=3001&par=1 HTTP/1.1 
 2344 33.435859310 192.168.8.120 → 10.3.141.125 TCP 1514 80 → 61632 [ACK] Seq=921169 Ack=1 Win=50440 Len=1448 TSval=2979940783 TSecr=1095327290
 2372 33.604946080 192.168.8.120 → 10.3.141.125 TCP 1514 80 → 61632 [ACK] Seq=937097 Ack=1 Win=50440 Len=1448 TSval=2979944335 TSecr=1095330784
 2393 34.006381862 192.168.8.120 → 10.3.141.125 TCP 1514 80 → 61807 [ACK] Seq=849977 Ack=1 Win=50440 Len=1448 TSval=2979944518 TSecr=3964665653
 2445 34.536865507 192.168.8.120 → 10.3.141.125 TCP 1514 80 → 61632 [ACK] Seq=957369 Ack=1 Win=50440 Len=1448 TSval=2979944701 TSecr=1095331194
 2496 35.414009153 192.168.8.120 → 10.3.141.125 TCP 1514 80 → 61807 [ACK] Seq=906449 Ack=1 Win=50440 Len=1448 TSval=2979945036 TSecr=3964666076
 2541 35.751328840 192.168.8.120 → 10.3.141.125 TCP 1514 80 → 61632 [ACK] Seq=987777 Ack=1 Win=50440 Len=1448 TSval=2979945325 TSecr=1095331860
 2553 35.795957225 192.168.8.120 → 10.3.141.125 HTTP/XML 163 HTTP/1.1 200 OK 
 2581 35.986528319 192.168.8.120 → 10.3.141.125 TCP 1514 80 → 61632 [ACK] Seq=1012393 Ack=1 Win=50440 Len=1448 TSval=2979946693 TSecr=1095333241
 2597 36.061958684 192.168.8.120 → 10.3.141.125 TCP 1514 80 → 61807 [ACK] Seq=933961 Ack=1 Win=50440 Len=1448 TSval=2979946695 TSecr=3964667613
 2600 36.068334777 192.168.8.120 → 10.3.141.125 TCP 1514 80 → 61807 [ACK] Seq=938305 Ack=1 Win=50440 Len=1448 TSval=2979946695 TSecr=3964667613
 2624 36.145066600 192.168.8.120 → 10.3.141.125 TCP 1514 80 → 61807 [ACK] Seq=968713 Ack=1 Win=50440 Len=1448 TSval=2979947262 TSecr=3964668397
 2628 36.154076757 192.168.8.120 → 10.3.141.125 TCP 1514 80 → 61807 [ACK] Seq=974505 Ack=1 Win=50440 Len=1448 TSval=2979947351 TSecr=3964668471
 2631 36.164136704 192.168.8.120 → 10.3.141.125 TCP 1514 80 → 61807 [ACK] Seq=978849 Ack=1 Win=50440 Len=1448 TSval=2979947351 TSecr=3964668471
 2635 36.172961548 192.168.8.120 → 10.3.141.125 TCP 1514 80 → 61807 [ACK] Seq=984641 Ack=1 Win=50440 Len=1448 TSval=2979947351 TSecr=3964668471
 2650 36.262403007 192.168.8.120 → 10.3.141.125 TCP 1514 80 → 61632 [ACK] Seq=1022529 Ack=1 Win=50440 Len=1448 TSval=2979947528 TSecr=1095334076
 2653 36.279824725 192.168.8.120 → 10.3.141.125 TCP 1514 80 → 61632 [ACK] Seq=1025425 Ack=1 Win=50440 Len=1448 TSval=2979947621 TSecr=1095334158
 2685 36.427550038 192.168.8.120 → 10.3.141.125 TCP 1514 80 → 61632 [ACK] Seq=1055833 Ack=1 Win=50440 Len=1448 TSval=2979947887 TSecr=1095334425
 2704 36.682551704 192.168.8.120 → 10.3.141.125 TCP 1514 80 → 61632 [ACK] Seq=1070313 Ack=1 Win=50440 Len=1448 TSval=2979947986 TSecr=1095334425
 2714 36.858725402  10.3.141.76 → 10.3.141.1   HTTP 141 POST /ajax/session/do_check_session.php HTTP/1.1  (application/x-www-form-urlencoded)
 2716 36.861421496   10.3.141.1 → 10.3.141.76  HTTP/JSON 388 HTTP/1.1 200 OK , JavaScript Object Notation (application/json)
 2825 41.152445348 10.3.141.125 → 192.168.8.120 HTTP 248 GET /?custom=1&cmd=3001&par=2 HTTP/1.1 
 2851 41.624616234 192.168.8.120 → 10.3.141.125 TCP 1514 80 → 61632 [ACK] Seq=1103617 Ack=1 Win=50440 Len=1448 TSval=2979952784 TSecr=1095339222
 2871 41.688338629 192.168.8.120 → 10.3.141.125 TCP 1514 80 → 61632 [ACK] Seq=1109409 Ack=1 Win=50440 Len=1448 TSval=2979952927 TSecr=1095339469
 2881 41.836406338  10.3.141.76 → 10.3.141.1   HTTP 141 POST /ajax/session/do_check_session.php HTTP/1.1  (application/x-www-form-urlencoded)
 2884 41.839611598   10.3.141.1 → 10.3.141.76  HTTP/JSON 388 HTTP/1.1 200 OK , JavaScript Object Notation (application/json)
 2888 41.848514984 192.168.8.120 → 10.3.141.125 TCP 1514 80 → 61632 [ACK] Seq=1118097 Ack=1 Win=50440 Len=1448 TSval=2979953309 TSecr=1095339846
 2895 41.866748317 192.168.8.120 → 10.3.141.125 TCP 1514 80 → 61632 [ACK] Seq=1122441 Ack=1 Win=50440 Len=1448 TSval=2979953400 TSecr=1095339952
 2915 41.914720765 192.168.8.120 → 10.3.141.125 HTTP/XML 163 HTTP/1.1 200 OK 
 2949 42.048106806 192.168.8.120 → 10.3.141.125 TCP 1514 80 → 61632 [ACK] Seq=1136921 Ack=1 Win=50440 Len=1448 TSval=2979953709 TSecr=1095340257
 2961 42.101843629 192.168.8.120 → 10.3.141.125 TCP 1514 80 → 61632 [ACK] Seq=1148505 Ack=1 Win=50440 Len=1448 TSval=2979953735 TSecr=1095340265
 3003 42.320639671 192.168.8.120 → 10.3.141.125 TCP 1514 80 → 61807 [ACK] Seq=1007809 Ack=1 Win=50440 Len=1448 TSval=2979953803 TSecr=3964674941
 3011 42.356117952 10.3.141.125 → 192.168.8.120 HTTP 242 GET /?custom=1&cmd=3012 HTTP/1.1 
 3022 42.399506963 192.168.8.120 → 10.3.141.125 TCP 1514 80 → 61632 [ACK] Seq=1162985 Ack=1 Win=50440 Len=1448 TSval=2979953860 TSecr=1095340409
 3034 42.454114931 192.168.8.120 → 10.3.141.125 TCP 1514 80 → 61807 [ACK] Seq=1025185 Ack=1 Win=50440 Len=1448 TSval=2979953895 TSecr=3964675027
 3074 42.652136077 192.168.8.120 → 10.3.141.125 TCP 1514 80 → 61807 [ACK] Seq=1035321 Ack=1 Win=50440 Len=1448 TSval=2979954043 TSecr=3964675182
 3095 43.517666858 192.168.8.120 → 10.3.141.125 TCP 1514 80 → 61807 [ACK] Seq=1049801 Ack=1 Win=50440 Len=1448 TSval=2979954151 TSecr=3964675289
 3103 43.552631233 192.168.8.120 → 10.3.141.125 TCP 1514 80 → 61807 [ACK] Seq=1055593 Ack=1 Win=50440 Len=1448 TSval=2979954163 TSecr=3964675304
^Ctshark: 
159 packets captured
evengers@raspberrypi:~ $ sudo tshark -i wlan0 -f "tcp port 80" -Y "http" -l  -whttp_capture.pcap -P
Running as user "root" and group "root". This could be dangerous.
tshark: Display filters aren't supported when capturing and saving the captured packets.
evengers@raspberrypi:~ $ sudo tshark -i wlan0 -f "tcp port 80" -Y   -whttp_capture.pcap -P
Running as user "root" and group "root". This could be dangerous.
tshark: Constant arithmetic expression on the LHS is invalid.
    -whttp_capture.pcap
     ^~~~~~~~~~~~~~~~~~
evengers@raspberrypi:~ $ sudo tshark -i wlan0 -f "tcp port 80" -Y   -w http_capture.pcap -P
Running as user "root" and group "root". This could be dangerous.
tshark: A capture filter was specified both with "-f" and with additional command-line arguments.
evengers@raspberrypi:~ $ sudo tshark -i wlan0 -f "tcp port 80"   -w http_capture.pcap -P
Running as user "root" and group "root". This could be dangerous.
Capturing on 'wlan0'
tshark: The file to which the capture would be saved ("http_capture.pcap") could not be opened: Permission denied.

tshark: 
0 packets captured
evengers@raspberrypi:~ $ sudo touch http_capture.pcap
evengers@raspberrypi:~ $ sudo tshark -i wlan0 -f "tcp port 80"   -w http_capture.pcap -P
Running as user "root" and group "root". This could be dangerous.
Capturing on 'wlan0'
tshark: The file to which the capture would be saved ("http_capture.pcap") could not be opened: Permission denied.

tshark: 
0 packets captured
evengers@raspberrypi:~ $ sudo nano http_capture.pcap
evengers@raspberrypi:~ $ sudo tshark -i wlan0 -f "tcp port 80"   -w http_capture.pcap -P
Running as user "root" and group "root". This could be dangerous.
Capturing on 'wlan0'
tshark: The file to which the capture would be saved ("http_capture.pcap") could not be opened: Permission denied.

tshark: 
0 packets captured
evengers@raspberrypi:~ $ sudo chmod 777 http_capture.pcap
evengers@raspberrypi:~ $ sudo tshark -i wlan0 -f "tcp port 80"   -w http_capture.pcap -P
Running as user "root" and group "root". This could be dangerous.
Capturing on 'wlan0'
tshark: The file to which the capture would be saved ("http_capture.pcap") could not be opened: Permission denied.

tshark: 
0 packets captured
evengers@raspberrypi:~ $ mkdir saveResults
evengers@raspberrypi:~ $ sudo chown $USER:$USER saveResults/
evengers@raspberrypi:~ $ sudo tshark -i wlan0 -f "tcp port 80"   -w saveResults/http_capture.pcap -P
Running as user "root" and group "root". This could be dangerous.
Capturing on 'wlan0'
tshark: The file to which the capture would be saved ("saveResults/http_capture.pcap") could not be opened: Permission denied.

tshark: 
0 packets captured
evengers@raspberrypi:~ $ sudo chmod 777 saveResults/
evengers@raspberrypi:~ $ sudo touch  saveResults/http_capture.pcap
evengers@raspberrypi:~ $ sudo chmod  saveResults/http_capture.pcap
chmod: missing operand after ‘saveResults/http_capture.pcap’
Try 'chmod --help' for more information.
evengers@raspberrypi:~ $ sudo chmod 777  saveResults/http_capture.pcap
evengers@raspberrypi:~ $ sudo tshark -i wlan0 -f "tcp port 80"   -w saveResults/http_capture.pcap -P
Running as user "root" and group "root". This could be dangerous.
Capturing on 'wlan0'
tshark: The file to which the capture would be saved ("saveResults/http_capture.pcap") could not be opened: Permission denied.

tshark: 
0 packets captured
evengers@raspberrypi:~ $ sudo tshark -i wlan0 -f "tcp port 80"   
Running as user "root" and group "root". This could be dangerous.
Capturing on 'wlan0'
 ** (tshark:2238) 13:01:07.232663 [Main MESSAGE] -- Capture started.
 ** (tshark:2238) 13:01:07.233114 [Main MESSAGE] -- File: "/tmp/wireshark_wlan0KN1112.pcapng"
    1 0.000000000  10.3.141.76 → 10.3.141.1   TCP 688 POST /ajax/session/do_check_session.php HTTP/1.1  [TCP segment of a reassembled PDU]
    2 0.000537343  10.3.141.76 → 10.3.141.1   HTTP 141 POST /ajax/session/do_check_session.php HTTP/1.1  (application/x-www-form-urlencoded)
    3 0.000809948   10.3.141.1 → 10.3.141.76  TCP 66 80 → 59855 [ACK] Seq=1 Ack=698 Win=352 Len=0 TSval=3740407693 TSecr=1632768094
    4 0.003542239   10.3.141.1 → 10.3.141.76  HTTP/JSON 389 HTTP/1.1 200 OK , JavaScript Object Notation (application/json)
    5 0.005336406  10.3.141.76 → 10.3.141.1   TCP 66 59855 → 80 [ACK] Seq=698 Ack=324 Win=2042 Len=0 TSval=1632768104 TSecr=3740407696
    6 4.996822133  10.3.141.76 → 10.3.141.1   TCP 688 POST /ajax/session/do_check_session.php HTTP/1.1  [TCP segment of a reassembled PDU]
    7 4.997446040  10.3.141.76 → 10.3.141.1   HTTP 141 POST /ajax/session/do_check_session.php HTTP/1.1  (application/x-www-form-urlencoded)
    8 4.997710727   10.3.141.1 → 10.3.141.76  TCP 66 80 → 59855 [ACK] Seq=324 Ack=1395 Win=352 Len=0 TSval=3740412690 TSecr=1632773087
    9 5.000343852   10.3.141.1 → 10.3.141.76  HTTP/JSON 389 HTTP/1.1 200 OK , JavaScript Object Notation (application/json)
   10 5.002329790  10.3.141.76 → 10.3.141.1   TCP 66 59855 → 80 [ACK] Seq=1395 Ack=647 Win=2042 Len=0 TSval=1632773096 TSecr=3740412693
   11 9.995271350  10.3.141.76 → 10.3.141.1   TCP 688 POST /ajax/session/do_check_session.php HTTP/1.1  [TCP segment of a reassembled PDU]
   12 9.995813590  10.3.141.76 → 10.3.141.1   HTTP 141 POST /ajax/session/do_check_session.php HTTP/1.1  (application/x-www-form-urlencoded)
   13 9.996071767   10.3.141.1 → 10.3.141.76  TCP 66 80 → 59855 [ACK] Seq=647 Ack=2092 Win=352 Len=0 TSval=3740417688 TSecr=1632778079
   14 9.998632183   10.3.141.1 → 10.3.141.76  HTTP/JSON 389 HTTP/1.1 200 OK , JavaScript Object Notation (application/json)
   15 10.000271871  10.3.141.76 → 10.3.141.1   TCP 66 59855 → 80 [ACK] Seq=2092 Ack=970 Win=2042 Len=0 TSval=1632778086 TSecr=3740417691
   16 14.997074577  10.3.141.76 → 10.3.141.1   TCP 688 POST /ajax/session/do_check_session.php HTTP/1.1  [TCP segment of a reassembled PDU]
   17 14.997782442  10.3.141.76 → 10.3.141.1   HTTP 141 POST /ajax/session/do_check_session.php HTTP/1.1  (application/x-www-form-urlencoded)
   18 14.997965671   10.3.141.1 → 10.3.141.76  TCP 66 80 → 59855 [ACK] Seq=970 Ack=2789 Win=352 Len=0 TSval=3740422690 TSecr=1632783073
   19 15.000468900   10.3.141.1 → 10.3.141.76  HTTP/JSON 389 HTTP/1.1 200 OK , JavaScript Object Notation (application/json)
   20 15.002277286  10.3.141.76 → 10.3.141.1   TCP 66 59855 → 80 [ACK] Seq=2789 Ack=1293 Win=2042 Len=0 TSval=1632783082 TSecr=3740422693
   21 19.997562596  10.3.141.76 → 10.3.141.1   TCP 688 POST /ajax/session/do_check_session.php HTTP/1.1  [TCP segment of a reassembled PDU]
   22 19.997954575  10.3.141.76 → 10.3.141.1   HTTP 141 POST /ajax/session/do_check_session.php HTTP/1.1  (application/x-www-form-urlencoded)
   23 19.998405825   10.3.141.1 → 10.3.141.76  TCP 66 80 → 59855 [ACK] Seq=1293 Ack=3486 Win=352 Len=0 TSval=3740427691 TSecr=1632788064
   24 20.001041555   10.3.141.1 → 10.3.141.76  HTTP/JSON 389 HTTP/1.1 200 OK , JavaScript Object Notation (application/json)
   25 20.002561138  10.3.141.76 → 10.3.141.1   TCP 66 59855 → 80 [ACK] Seq=3486 Ack=1616 Win=2042 Len=0 TSval=1632788073 TSecr=3740427693
   26 25.001804001  10.3.141.76 → 10.3.141.1   TCP 688 POST /ajax/session/do_check_session.php HTTP/1.1  [TCP segment of a reassembled PDU]
   27 25.002107126  10.3.141.76 → 10.3.141.1   HTTP 141 POST /ajax/session/do_check_session.php HTTP/1.1  (application/x-www-form-urlencoded)
   28 25.002387646   10.3.141.1 → 10.3.141.76  TCP 66 80 → 59855 [FIN, ACK] Seq=1616 Ack=4183 Win=348 Len=0 TSval=3740432695 TSecr=1632793062
   29 25.003859990  10.3.141.76 → 10.3.141.1   TCP 66 59855 → 80 [ACK] Seq=4183 Ack=1617 Win=2048 Len=0 TSval=1632793068 TSecr=3740432695
   30 25.004128063  10.3.141.76 → 10.3.141.1   TCP 66 59855 → 80 [FIN, ACK] Seq=4183 Ack=1617 Win=2048 Len=0 TSval=1632793068 TSecr=3740432695
   31 25.004179469   10.3.141.1 → 10.3.141.76  TCP 66 80 → 59855 [ACK] Seq=1617 Ack=4184 Win=350 Len=0 TSval=3740432696 TSecr=1632793068
   32 30.001738165  10.3.141.76 → 10.3.141.1   TCP 78 59892 → 80 [SYN, ECE, CWR] Seq=0 Win=65535 Len=0 MSS=1460 WS=64 TSval=2042269504 TSecr=0 SACK_PERM
   33 30.001976811   10.3.141.1 → 10.3.141.76  TCP 74 80 → 59892 [SYN, ACK, ECE] Seq=0 Ack=1 Win=65160 Len=0 MSS=1460 SACK_PERM TSval=3740437694 TSecr=2042269504 WS=128
   34 30.003482332  10.3.141.76 → 10.3.141.1   TCP 66 59892 → 80 [ACK] Seq=1 Ack=1 Win=131712 Len=0 TSval=2042269512 TSecr=3740437694
   35 30.004429988  10.3.141.76 → 10.3.141.1   TCP 688 POST /ajax/session/do_check_session.php HTTP/1.1  [TCP segment of a reassembled PDU]
   36 30.004515092   10.3.141.1 → 10.3.141.76  TCP 66 80 → 59892 [ACK] Seq=1 Ack=623 Win=64640 Len=0 TSval=3740437697 TSecr=2042269512
   37 30.005099155  10.3.141.76 → 10.3.141.1   HTTP 141 POST /ajax/session/do_check_session.php HTTP/1.1  (application/x-www-form-urlencoded)
   38 30.005157228   10.3.141.1 → 10.3.141.76  TCP 66 80 → 59892 [ACK] Seq=1 Ack=698 Win=64640 Len=0 TSval=3740437697 TSecr=2042269513
   39 30.007591290   10.3.141.1 → 10.3.141.76  HTTP/JSON 389 HTTP/1.1 200 OK , JavaScript Object Notation (application/json)
   40 30.009323217  10.3.141.76 → 10.3.141.1   TCP 66 59892 → 80 [ACK] Seq=698 Ack=324 Win=131392 Len=0 TSval=2042269516 TSecr=3740437700
   41 34.998464986  10.3.141.76 → 10.3.141.1   TCP 688 POST /ajax/session/do_check_session.php HTTP/1.1  [TCP segment of a reassembled PDU]
   42 34.998673684  10.3.141.76 → 10.3.141.1   HTTP 141 POST /ajax/session/do_check_session.php HTTP/1.1  (application/x-www-form-urlencoded)
   43 34.998876445   10.3.141.1 → 10.3.141.76  TCP 66 80 → 59892 [ACK] Seq=324 Ack=1395 Win=64000 Len=0 TSval=3740442691 TSecr=2042274495
   44 35.001082486   10.3.141.1 → 10.3.141.76  HTTP/JSON 389 HTTP/1.1 200 OK , JavaScript Object Notation (application/json)
   45 35.003383580  10.3.141.76 → 10.3.141.1   TCP 66 59892 → 80 [ACK] Seq=1395 Ack=647 Win=131072 Len=0 TSval=2042274503 TSecr=3740442693
   46 39.999753995  10.3.141.76 → 10.3.141.1   TCP 688 POST /ajax/session/do_check_session.php HTTP/1.1  [TCP segment of a reassembled PDU]
   47 40.000174932  10.3.141.76 → 10.3.141.1   HTTP 141 POST /ajax/session/do_check_session.php HTTP/1.1  (application/x-www-form-urlencoded)
   48 40.000343630   10.3.141.1 → 10.3.141.76  TCP 66 80 → 59892 [ACK] Seq=647 Ack=2092 Win=63360 Len=0 TSval=3740447693 TSecr=2042279487
   49 40.002933370   10.3.141.1 → 10.3.141.76  HTTP/JSON 389 HTTP/1.1 200 OK , JavaScript Object Notation (application/json)
   50 40.005476547  10.3.141.76 → 10.3.141.1   TCP 66 59892 → 80 [ACK] Seq=2092 Ack=970 Win=130752 Len=0 TSval=2042279496 TSecr=3740447695
   51 45.000928733  10.3.141.76 → 10.3.141.1   TCP 688 POST /ajax/session/do_check_session.php HTTP/1.1  [TCP segment of a reassembled PDU]
   52 45.001569462  10.3.141.76 → 10.3.141.1   HTTP 141 POST /ajax/session/do_check_session.php HTTP/1.1  (application/x-www-form-urlencoded)
   53 45.001868264   10.3.141.1 → 10.3.141.76  TCP 66 80 → 59892 [ACK] Seq=970 Ack=2789 Win=62720 Len=0 TSval=3740452694 TSecr=2042284481
   54 45.004290191   10.3.141.1 → 10.3.141.76  HTTP/JSON 389 HTTP/1.1 200 OK , JavaScript Object Notation (application/json)
   55 45.005897274  10.3.141.76 → 10.3.141.1   TCP 66 59892 → 80 [ACK] Seq=2789 Ack=1293 Win=130688 Len=0 TSval=2042284490 TSecr=3740452696
   56 50.000821022  10.3.141.76 → 10.3.141.1   TCP 688 POST /ajax/session/do_check_session.php HTTP/1.1  [TCP segment of a reassembled PDU]
   57 50.001089304  10.3.141.76 → 10.3.141.1   HTTP 141 POST /ajax/session/do_check_session.php HTTP/1.1  (application/x-www-form-urlencoded)
   58 50.001329252   10.3.141.1 → 10.3.141.76  TCP 66 80 → 59892 [ACK] Seq=1293 Ack=3486 Win=62080 Len=0 TSval=3740457693 TSecr=2042289472
   59 50.003761074   10.3.141.1 → 10.3.141.76  HTTP/JSON 389 HTTP/1.1 200 OK , JavaScript Object Notation (application/json)
   60 50.005123418  10.3.141.76 → 10.3.141.1   TCP 66 59892 → 80 [ACK] Seq=3486 Ack=1616 Win=130688 Len=0 TSval=2042289480 TSecr=3740457696
   61 55.005826073  10.3.141.76 → 10.3.141.1   TCP 688 POST /ajax/session/do_check_session.php HTTP/1.1  [TCP segment of a reassembled PDU]
   62 55.006083312  10.3.141.76 → 10.3.141.1   HTTP 141 POST /ajax/session/do_check_session.php HTTP/1.1  (application/x-www-form-urlencoded)
   63 55.006338520   10.3.141.1 → 10.3.141.76  TCP 66 80 → 59892 [ACK] Seq=1616 Ack=4183 Win=61440 Len=0 TSval=3740462699 TSecr=2042294470
   64 55.008802948   10.3.141.1 → 10.3.141.76  HTTP/JSON 389 HTTP/1.1 200 OK , JavaScript Object Notation (application/json)
   65 55.010160187  10.3.141.76 → 10.3.141.1   TCP 66 59892 → 80 [ACK] Seq=4183 Ack=1939 Win=130688 Len=0 TSval=2042294478 TSecr=3740462701
   66 60.005187425  10.3.141.76 → 10.3.141.1   TCP 688 POST /ajax/session/do_check_session.php HTTP/1.1  [TCP segment of a reassembled PDU]
   67 60.005622269  10.3.141.76 → 10.3.141.1   HTTP 141 POST /ajax/session/do_check_session.php HTTP/1.1  (application/x-www-form-urlencoded)
   68 60.005791591   10.3.141.1 → 10.3.141.76  TCP 66 80 → 59892 [ACK] Seq=1939 Ack=4880 Win=60800 Len=0 TSval=3740467698 TSecr=2042299458
   69 60.008204664   10.3.141.1 → 10.3.141.76  HTTP/JSON 389 HTTP/1.1 200 OK , JavaScript Object Notation (application/json)
   70 60.009551123  10.3.141.76 → 10.3.141.1   TCP 66 59892 → 80 [ACK] Seq=4880 Ack=2262 Win=130688 Len=0 TSval=2042299468 TSecr=3740467700
   71 65.008291694  10.3.141.76 → 10.3.141.1   TCP 688 POST /ajax/session/do_check_session.php HTTP/1.1  [TCP segment of a reassembled PDU]
   72 65.008550079  10.3.141.76 → 10.3.141.1   HTTP 141 POST /ajax/session/do_check_session.php HTTP/1.1  (application/x-www-form-urlencoded)
   73 65.008763204   10.3.141.1 → 10.3.141.76  TCP 66 80 → 59892 [ACK] Seq=2262 Ack=5577 Win=60160 Len=0 TSval=3740472701 TSecr=2042304454
   74 65.011407735   10.3.141.1 → 10.3.141.76  HTTP/JSON 389 HTTP/1.1 200 OK , JavaScript Object Notation (application/json)
   75 65.013083985  10.3.141.76 → 10.3.141.1   TCP 66 59892 → 80 [ACK] Seq=5577 Ack=2585 Win=130688 Len=0 TSval=2042304466 TSecr=3740472704
   76 70.004160233  10.3.141.76 → 10.3.141.1   TCP 688 POST /ajax/session/do_check_session.php HTTP/1.1  [TCP segment of a reassembled PDU]
   77 70.004467942  10.3.141.76 → 10.3.141.1   HTTP 141 POST /ajax/session/do_check_session.php HTTP/1.1  (application/x-www-form-urlencoded)
   78 70.004679504   10.3.141.1 → 10.3.141.76  TCP 66 80 → 59892 [ACK] Seq=2585 Ack=6274 Win=59520 Len=0 TSval=3740477697 TSecr=2042309445
   79 70.007236744   10.3.141.1 → 10.3.141.76  HTTP/JSON 389 HTTP/1.1 200 OK , JavaScript Object Notation (application/json)
   80 70.008652577  10.3.141.76 → 10.3.141.1   TCP 66 59892 → 80 [ACK] Seq=6274 Ack=2908 Win=130688 Len=0 TSval=2042309453 TSecr=3740477699
   81 75.007490752  10.3.141.76 → 10.3.141.1   TCP 688 POST /ajax/session/do_check_session.php HTTP/1.1  [TCP segment of a reassembled PDU]
   82 75.007751117  10.3.141.76 → 10.3.141.1   HTTP 141 POST /ajax/session/do_check_session.php HTTP/1.1  (application/x-www-form-urlencoded)
   83 75.008006273   10.3.141.1 → 10.3.141.76  TCP 66 80 → 59892 [ACK] Seq=2908 Ack=6971 Win=58880 Len=0 TSval=3740482700 TSecr=2042314442
   84 75.010387888   10.3.141.1 → 10.3.141.76  HTTP/JSON 389 HTTP/1.1 200 OK , JavaScript Object Notation (application/json)
   85 75.011987159  10.3.141.76 → 10.3.141.1   TCP 66 59892 → 80 [ACK] Seq=6971 Ack=3231 Win=130688 Len=0 TSval=2042314451 TSecr=3740482703
   86 75.369214711 10.3.141.125 → 192.168.8.120 TCP 78 52257 → 80 [SYN, ECE, CWR] Seq=0 Win=65535 Len=0 MSS=1460 WS=64 TSval=1979372912 TSecr=0 SACK_PERM
   87 75.536890544 192.168.8.120 → 10.3.141.125 TCP 74 80 → 52257 [SYN, ACK, ECE] Seq=0 Ack=1 Win=50680 Len=0 MSS=1460 SACK_PERM TSval=2980629171 TSecr=1979372912 WS=1
   88 75.639248617 10.3.141.125 → 192.168.8.120 TCP 66 52257 → 80 [ACK] Seq=1 Ack=1 Win=131712 Len=0 TSval=1979373180 TSecr=2980629171
   89 75.639577315 10.3.141.125 → 192.168.8.120 HTTP 248 GET /?custom=1&cmd=3001&par=2 HTTP/1.1 
   90 75.741080231 192.168.8.120 → 10.3.141.125 TCP 66 80 → 52257 [ACK] Seq=1 Ack=183 Win=50498 Len=0 TSval=2980629445 TSecr=1979373181
   91 76.149623721 192.168.8.120 → 10.3.141.125 HTTP 163 [TCP Previous segment not captured] Continuation
   92 76.251909137 10.3.141.125 → 192.168.8.120 TCP 78 [TCP Dup ACK 88#1] 52257 → 80 [ACK] Seq=183 Ack=1 Win=131712 Len=0 TSval=1979373794 TSecr=2980629445 SLE=197 SRE=295
   93 76.266607627 192.168.8.120 → 10.3.141.125 TCP 163 [TCP Retransmission] 80 → 52257 [FIN, PSH, ACK] Seq=197 Ack=183 Win=50498 Len=97 TSval=2980630019 TSecr=1979373181
   94 76.269589710 10.3.141.125 → 192.168.8.120 TCP 86 [TCP Dup ACK 88#2] 52257 → 80 [ACK] Seq=183 Ack=1 Win=131712 Len=0 TSval=1979373817 TSecr=2980629445 SLE=197 SRE=294 SLE=197 SRE=295
   95 77.032769241 10.3.141.125 → 192.168.8.120 TCP 78 52258 → 80 [SYN, ECE, CWR] Seq=0 Win=65535 Len=0 MSS=1460 WS=64 TSval=2677383877 TSecr=0 SACK_PERM
   96 77.040618772 192.168.8.120 → 10.3.141.125 TCP 74 80 → 52258 [SYN, ACK, ECE] Seq=0 Ack=1 Win=50680 Len=0 MSS=1460 SACK_PERM TSval=2980630840 TSecr=2677383877 WS=1
   97 77.042725075 10.3.141.125 → 192.168.8.120 TCP 66 52258 → 80 [ACK] Seq=1 Ack=1 Win=131712 Len=0 TSval=2677383891 TSecr=2980630840
   98 77.043815231 10.3.141.125 → 192.168.8.120 HTTP 248 GET /?custom=1&cmd=3001&par=2 HTTP/1.1 
